15:53:42.558361 IP ns1.ssh > 147.178.6.131.27196: Flags [P.], seq 4291290383:4291290495, ack 3228877921, win 349, length 112
15:53:42.558429 IP ns1.ssh > 147.178.6.131.27196: Flags [P.], seq 112:160, ack 1, win 349, length 48
15:53:42.558455 IP ns1.ssh > 147.178.6.131.27196: Flags [P.], seq 160:288, ack 1, win 349, length 128
15:53:42.558492 IP ns1.ssh > 147.178.6.131.27196: Flags [P.], seq 288:336, ack 1, win 349, length 48
15:53:42.735283 IP 147.178.6.131.27196 > ns1.ssh: Flags [.], ack 336, win 251, length 0
15:53:43.581653 IP ns1.49759 > 10.0.0.2.domain: 22741+ [1au] PTR? 131.6.178.147.in-addr.arpa. (55)
15:53:43.617309 IP 10.0.0.2.domain > ns1.49759: 22741 NXDomain 0/1/1 (113)
15:53:43.617448 IP ns1.49759 > 10.0.0.2.domain: 22741+ PTR? 131.6.178.147.in-addr.arpa. (44)
15:53:43.617807 IP 10.0.0.2.domain > ns1.49759: 22741 NXDomain 0/1/0 (102)
15:53:48.266921 IP 147.178.6.131.27575 > ns1.ssh: Flags [P.], seq 1508768311:1508768359, ack 432387516, win 256, length 48
15:53:48.266948 IP ns1.ssh > 147.178.6.131.27575: Flags [.], ack 48, win 331, length 0
15:53:48.267615 IP ns1.ssh > 147.178.6.131.27575: Flags [P.], seq 1:97, ack 48, win 331, length 96
15:53:48.483931 IP 147.178.6.131.27575 > ns1.ssh: Flags [.], ack 97, win 256, length 0
15:53:48.700988 ARP, Request who-has 10.0.0.2 tell ns1, length 28
15:53:48.701145 ARP, Reply 10.0.0.2 is-at 06:6f:f1:1b:20:c0 (oui Unknown), length 42
15:53:48.954993 IP 147.178.6.131.27575 > ns1.ssh: Flags [P.], seq 48:96, ack 97, win 256, length 48
15:53:48.955224 IP ns1.ssh > 147.178.6.131.27575: Flags [P.], seq 97:193, ack 96, win 331, length 96
15:53:49.172924 IP 147.178.6.131.27575 > ns1.ssh: Flags [.], ack 193, win 255, length 0
15:53:50.443292 IP 147.178.6.131.27575 > ns1.ssh: Flags [P.], seq 96:144, ack 193, win 255, length 48
15:53:50.443501 IP ns1.ssh > 147.178.6.131.27575: Flags [P.], seq 193:257, ack 144, win 331, length 64
15:53:50.612296 IP 147.178.6.131.27575 > ns1.ssh: Flags [P.], seq 144:192, ack 193, win 255, length 48
15:53:50.612508 IP ns1.ssh > 147.178.6.131.27575: Flags [P.], seq 257:321, ack 192, win 331, length 64
15:53:50.661995 IP 147.178.6.131.27575 > ns1.ssh: Flags [.], ack 257, win 255, length 0
15:53:50.763093 IP 147.178.6.131.27575 > ns1.ssh: Flags [P.], seq 192:240, ack 257, win 255, length 48
15:53:50.763284 IP ns1.ssh > 147.178.6.131.27575: Flags [P.], seq 321:369, ack 240, win 331, length 48
15:53:50.830351 IP 147.178.6.131.27575 > ns1.ssh: Flags [.], ack 321, win 255, length 0
15:53:50.907138 IP 147.178.6.131.27575 > ns1.ssh: Flags [P.], seq 240:288, ack 321, win 255, length 48
15:53:50.907341 IP ns1.ssh > 147.178.6.131.27575: Flags [P.], seq 369:433, ack 288, win 331, length 64
15:53:50.980499 IP 147.178.6.131.27575 > ns1.ssh: Flags [.], ack 369, win 255, length 0
15:53:51.066979 IP 147.178.6.131.27575 > ns1.ssh: Flags [P.], seq 288:336, ack 369, win 255, length 48
15:53:51.067177 IP ns1.ssh > 147.178.6.131.27575: Flags [P.], seq 433:481, ack 336, win 331, length 48
15:53:51.123999 IP 147.178.6.131.27575 > ns1.ssh: Flags [.], ack 433, win 254, length 0
15:53:51.267761 IP 147.178.6.131.27575 > ns1.ssh: Flags [P.], seq 336:384, ack 481, win 254, length 48
15:53:51.267966 IP ns1.ssh > 147.178.6.131.27575: Flags [P.], seq 481:529, ack 384, win 331, length 48
15:53:51.485455 IP 147.178.6.131.27575 > ns1.ssh: Flags [.], ack 529, win 254, length 0
15:53:52.171224 IP 147.178.6.131.27575 > ns1.ssh: Flags [P.], seq 384:432, ack 529, win 254, length 48
15:53:52.171425 IP ns1.ssh > 147.178.6.131.27575: Flags [P.], seq 529:593, ack 432, win 331, length 64
15:53:52.388331 IP 147.178.6.131.27575 > ns1.ssh: Flags [.], ack 593, win 254, length 0
15:53:52.804340 IP 147.178.6.131.27575 > ns1.ssh: Flags [P.], seq 432:480, ack 593, win 254, length 48
15:53:52.804520 IP ns1.ssh > 147.178.6.131.27575: Flags [P.], seq 593:641, ack 480, win 331, length 48
15:53:52.966327 IP 147.178.6.131.27575 > ns1.ssh: Flags [P.], seq 480:528, ack 593, win 254, length 48
15:53:52.966518 IP ns1.ssh > 147.178.6.131.27575: Flags [P.], seq 641:689, ack 528, win 331, length 48
15:53:53.022320 IP 147.178.6.131.27575 > ns1.ssh: Flags [.], ack 641, win 254, length 0
15:53:53.115521 IP 147.178.6.131.27575 > ns1.ssh: Flags [P.], seq 528:576, ack 641, win 254, length 48
15:53:53.115708 IP ns1.ssh > 147.178.6.131.27575: Flags [P.], seq 689:737, ack 576, win 331, length 48
15:53:53.182952 IP 147.178.6.131.27575 > ns1.ssh: Flags [.], ack 689, win 253, length 0
15:53:53.333322 IP 147.178.6.131.27575 > ns1.ssh: Flags [.], ack 737, win 253, length 0
15:53:53.515274 IP 147.178.6.131.27575 > ns1.ssh: Flags [P.], seq 576:624, ack 737, win 253, length 48
15:53:53.515469 IP ns1.ssh > 147.178.6.131.27575: Flags [P.], seq 737:785, ack 624, win 331, length 48
15:53:53.732025 IP 147.178.6.131.27575 > ns1.ssh: Flags [.], ack 785, win 253, length 0
15:53:53.793868 IP 147.178.6.131.27575 > ns1.ssh: Flags [P.], seq 624:672, ack 785, win 253, length 48
15:53:53.794277 IP ns1.ssh > 147.178.6.131.27575: Flags [P.], seq 785:849, ack 672, win 331, length 64
15:53:54.010924 IP 147.178.6.131.27575 > ns1.ssh: Flags [.], ack 849, win 253, length 0
15:53:54.500763 IP 147.178.6.131.27575 > ns1.ssh: Flags [P.], seq 672:720, ack 849, win 253, length 48
15:53:54.501192 IP ns1.ssh > 147.178.6.131.27575: Flags [P.], seq 849:897, ack 720, win 331, length 48
15:53:54.718493 IP 147.178.6.131.27575 > ns1.ssh: Flags [.], ack 897, win 253, length 0
15:53:54.986218 IP 147.178.6.131.27575 > ns1.ssh: Flags [P.], seq 720:768, ack 897, win 253, length 48
15:53:54.986413 IP ns1.ssh > 147.178.6.131.27575: Flags [P.], seq 897:945, ack 768, win 331, length 48
15:53:55.106522 IP 147.178.6.131.27575 > ns1.ssh: Flags [P.], seq 768:816, ack 897, win 253, length 48
15:53:55.106915 IP ns1.ssh > 147.178.6.131.27575: Flags [P.], seq 945:993, ack 816, win 331, length 48
15:53:55.203703 IP 147.178.6.131.27575 > ns1.ssh: Flags [.], ack 945, win 252, length 0
15:53:55.298563 IP 147.178.6.131.27575 > ns1.ssh: Flags [P.], seq 816:864, ack 993, win 252, length 48
15:53:55.299153 IP ns1.ssh > 147.178.6.131.27575: Flags [P.], seq 993:1057, ack 864, win 331, length 64
15:53:55.520820 IP 147.178.6.131.27575 > ns1.ssh: Flags [.], ack 1057, win 252, length 0
15:54:03.285015 IP 61.184.247.4.42468 > ns1.ssh: Flags [S], seq 1692472923, win 29200, options [mss 1460,sackOK,TS val 3376795 ecr 0,nop,wscale 7], length 0
15:54:03.285043 IP ns1.ssh > 61.184.247.4.42468: Flags [S.], seq 4266252647, ack 1692472924, win 26847, options [mss 8961,sackOK,TS val 2911086946 ecr 3376795,nop,wscale 7], length 0
15:54:03.522122 IP 61.184.247.4.42468 > ns1.ssh: Flags [.], ack 1, win 229, options [nop,nop,TS val 3376854 ecr 2911086946], length 0
15:54:03.522160 IP 61.184.247.4.42468 > ns1.ssh: Flags [P.], seq 1:16, ack 1, win 229, options [nop,nop,TS val 3376854 ecr 2911086946], length 15
15:54:03.522170 IP ns1.ssh > 61.184.247.4.42468: Flags [.], ack 16, win 210, options [nop,nop,TS val 2911087183 ecr 3376854], length 0
15:54:03.526859 IP ns1.ssh > 61.184.247.4.42468: Flags [P.], seq 1:42, ack 16, win 210, options [nop,nop,TS val 2911087188 ecr 3376854], length 41
15:54:03.765824 IP 61.184.247.4.42468 > ns1.ssh: Flags [.], ack 42, win 229, options [nop,nop,TS val 3376915 ecr 2911087188], length 0
15:54:03.765848 IP ns1.ssh > 61.184.247.4.42468: Flags [P.], seq 42:1122, ack 16, win 210, options [nop,nop,TS val 2911087427 ecr 3376915], length 1080
15:54:03.765860 IP 61.184.247.4.42468 > ns1.ssh: Flags [P.], seq 16:664, ack 42, win 229, options [nop,nop,TS val 3376915 ecr 2911087188], length 648
15:54:03.808959 IP ns1.ssh > 61.184.247.4.42468: Flags [.], ack 664, win 220, options [nop,nop,TS val 2911087470 ecr 3376915], length 0
15:54:04.040075 IP 61.184.247.4.42468 > ns1.ssh: Flags [.], ack 1122, win 245, options [nop,nop,TS val 3376984 ecr 2911087427], length 0
15:54:04.046704 IP 61.184.247.4.42468 > ns1.ssh: Flags [P.], seq 664:936, ack 1122, win 245, options [nop,nop,TS val 3376985 ecr 2911087470], length 272
15:54:04.046728 IP ns1.ssh > 61.184.247.4.42468: Flags [.], ack 936, win 230, options [nop,nop,TS val 2911087708 ecr 3376985], length 0
15:54:04.048861 IP ns1.ssh > 61.184.247.4.42468: Flags [P.], seq 1122:1970, ack 936, win 230, options [nop,nop,TS val 2911087710 ecr 3376985], length 848
15:54:04.061246 IP ns1.47048 > 10.0.0.2.domain: 12818+ [1au] PTR? 4.247.184.61.in-addr.arpa. (54)
15:54:04.063002 IP 10.0.0.2.domain > ns1.47048: 12818 NXDomain 0/1/1 (112)
15:54:04.063065 IP ns1.47048 > 10.0.0.2.domain: 12818+ PTR? 4.247.184.61.in-addr.arpa. (43)
15:54:04.063378 IP 10.0.0.2.domain > ns1.47048: 12818 NXDomain 0/1/0 (101)
15:54:04.287484 IP 61.184.247.4.42468 > ns1.ssh: Flags [.], ack 1970, win 262, options [nop,nop,TS val 3377045 ecr 2911087710], length 0
15:54:04.289203 IP 61.184.247.4.42468 > ns1.ssh: Flags [P.], seq 936:952, ack 1970, win 262, options [nop,nop,TS val 3377046 ecr 2911087710], length 16
15:54:04.332960 IP ns1.ssh > 61.184.247.4.42468: Flags [.], ack 952, win 230, options [nop,nop,TS val 2911087994 ecr 3377046], length 0
15:54:04.572827 IP 61.184.247.4.42468 > ns1.ssh: Flags [P.], seq 952:1004, ack 1970, win 262, options [nop,nop,TS val 3377117 ecr 2911087994], length 52
15:54:04.572854 IP ns1.ssh > 61.184.247.4.42468: Flags [.], ack 1004, win 230, options [nop,nop,TS val 2911088234 ecr 3377117], length 0
15:54:04.572938 IP ns1.ssh > 61.184.247.4.42468: Flags [P.], seq 1970:2022, ack 1004, win 230, options [nop,nop,TS val 2911088234 ecr 3377117], length 52
15:54:04.810595 IP 61.184.247.4.42468 > ns1.ssh: Flags [P.], seq 1004:1072, ack 2022, win 262, options [nop,nop,TS val 3377176 ecr 2911088234], length 68
15:54:04.812284 IP ns1.ssh > 61.184.247.4.42468: Flags [P.], seq 2022:2074, ack 1072, win 230, options [nop,nop,TS val 2911088473 ecr 3377176], length 52
15:54:05.053756 IP 61.184.247.4.42468 > ns1.ssh: Flags [P.], seq 1072:1124, ack 2074, win 262, options [nop,nop,TS val 3377237 ecr 2911088473], length 52
15:54:05.053827 IP 61.184.247.4.42468 > ns1.ssh: Flags [F.], seq 1124, ack 2074, win 262, options [nop,nop,TS val 3377237 ecr 2911088473], length 0
15:54:05.055442 IP ns1.ssh > 61.184.247.4.42468: Flags [F.], seq 2074, ack 1125, win 230, options [nop,nop,TS val 2911088716 ecr 3377237], length 0
15:54:05.299180 IP 61.184.247.4.42468 > ns1.ssh: Flags [.], ack 2075, win 262, options [nop,nop,TS val 3377298 ecr 2911088716], length 0
15:54:11.676540 ARP, Request who-has ns1 tell _gateway, length 42
15:54:11.676554 ARP, Reply ns1 is-at 06:9e:a4:f5:8b:82 (oui Unknown), length 28
15:54:31.978112 IP 32.129.157.37.rev.izzycom.net.43354 > ns1.domain: 64588 [1au] A? www.probe_24288.iotsecproject.tech. (63)
15:54:31.978357 IP ns1.domain > 32.129.157.37.rev.izzycom.net.43354: 64588 NXDomain*- 0/1/1 (109)
15:54:32.577583 IP 62.34.202.138.51139 > ns1.domain: 28855% [1au] A? www.probe_18240.iotsecproject.tech. (63)
15:54:32.577753 IP ns1.domain > 62.34.202.138.51139: 28855 NXDomain*- 0/1/1 (109)
15:54:32.733296 IP ns1.43923 > 10.0.0.2.domain: 48153+ [1au] PTR? 32.129.157.37.in-addr.arpa. (55)
15:54:32.959215 IP 10.0.0.2.domain > ns1.43923: 48153 1/0/1 PTR 32.129.157.37.rev.izzycom.net. (98)
15:54:32.959664 IP ns1.44950 > 10.0.0.2.domain: 15701+ [1au] PTR? 138.202.34.62.in-addr.arpa. (55)
15:54:33.070034 IP 10.0.0.2.domain > ns1.44950: 15701 NXDomain 0/1/1 (138)
15:54:33.070171 IP ns1.44950 > 10.0.0.2.domain: 15701+ PTR? 138.202.34.62.in-addr.arpa. (44)
15:54:33.070517 IP 10.0.0.2.domain > ns1.44950: 15701 NXDomain 0/1/0 (127)
15:54:33.109833 IP 74.125.74.7.45489 > ns1.domain: 47090% [1au] A? www.probe_12078.iotsecproject.tech. (74)
15:54:33.109997 IP ns1.domain > 74.125.74.7.45489: 47090 NXDomain*- 0/1/1 (120)
15:54:33.123550 IP res300.cdg.rrdns.pch.net.35176 > ns1.domain: 43466% [1au] A? www.probe_24288.iotsecproject.tech. (63)
15:54:33.123669 IP ns1.domain > res300.cdg.rrdns.pch.net.35176: 43466 NXDomain*- 0/1/1 (109)
15:54:33.132192 IP res300.cdg.rrdns.pch.net.17034 > ns1.domain: 44882% [1au] A? ns2.iotsecproject.TECH. (51)
15:54:33.132332 IP ns1.domain > res300.cdg.rrdns.pch.net.17034: 44882*- 1/2/2 A 18.222.233.237 (137)
15:54:33.133314 IP res300.cdg.rrdns.pch.net.28427 > ns1.domain: 28520% [1au] A? ns1.iotsecproject.TECH. (51)
15:54:33.133376 IP ns1.domain > res300.cdg.rrdns.pch.net.28427: 28520*- 1/2/2 A 18.222.233.237 (137)
15:54:33.133454 IP res300.cdg.rrdns.pch.net.25650 > ns1.domain: 40714% [1au] NS? iotsecproject.TECH. (47)
15:54:33.133501 IP ns1.domain > res300.cdg.rrdns.pch.net.25650: 40714*- 2/0/3 NS ns2.iotsecproject.tech., NS ns1.iotsecproject.tech. (133)
15:54:33.256718 IP res300.cdg.rrdns.pch.net.39077 > ns1.domain: 41729% [1au] AAAA? ns2.iotsecproject.tech. (51)
15:54:33.256876 IP ns1.domain > res300.cdg.rrdns.pch.net.39077: 41729*- 0/1/1 (97)
15:54:33.258788 IP res300.cdg.rrdns.pch.net.64196 > ns1.domain: 28793% [1au] AAAA? ns1.iotsecproject.tech. (51)
15:54:33.258845 IP ns1.domain > res300.cdg.rrdns.pch.net.64196: 28793*- 0/1/1 (93)
15:54:33.757304 IP ns1.52121 > 10.0.0.2.domain: 20224+ [1au] PTR? 7.74.125.74.in-addr.arpa. (53)
15:54:33.777059 IP 10.0.0.2.domain > ns1.52121: 20224 NXDomain 0/1/1 (113)
15:54:33.777148 IP ns1.52121 > 10.0.0.2.domain: 20224+ PTR? 7.74.125.74.in-addr.arpa. (42)
15:54:33.777500 IP 10.0.0.2.domain > ns1.52121: 20224 NXDomain 0/1/0 (102)
15:54:33.777859 IP ns1.58574 > 10.0.0.2.domain: 22114+ [1au] PTR? 244.123.185.66.in-addr.arpa. (56)
15:54:33.938967 IP 10.0.0.2.domain > ns1.58574: 22114 1/0/1 PTR res300.cdg.rrdns.pch.net. (94)
15:54:33.939537 IP ns1.ssh > 147.178.6.131.27575: Flags [P.], seq 1057:1249, ack 864, win 331, length 192
15:54:34.157696 IP 147.178.6.131.27575 > ns1.ssh: Flags [.], ack 1249, win 251, length 0
15:54:34.305295 IP 173.194.98.12.53443 > ns1.domain: 62706% [1au] A? www.probe_12078.iotsecproject.tech. (74)
15:54:34.305469 IP ns1.domain > 173.194.98.12.53443: 62706 NXDomain*- 0/1/1 (120)
15:54:34.608402 IP ns3.telemaxx.net.47567 > ns1.domain: 56414 [1au] A? www.probe_34798.iotsecproject.tech. (63)
15:54:34.608572 IP ns1.domain > ns3.telemaxx.net.47567: 56414 NXDomain*- 0/1/1 (109)
15:54:34.781305 IP ns1.59538 > 10.0.0.2.domain: 54203+ [1au] PTR? 12.98.194.173.in-addr.arpa. (55)
15:54:34.801502 IP 10.0.0.2.domain > ns1.59538: 54203 NXDomain 0/1/1 (115)
15:54:34.801990 IP ns1.59538 > 10.0.0.2.domain: 54203+ PTR? 12.98.194.173.in-addr.arpa. (44)
15:54:34.802351 IP 10.0.0.2.domain > ns1.59538: 54203 NXDomain 0/1/0 (104)
15:54:34.802711 IP ns1.59386 > 10.0.0.2.domain: 29820+ [1au] PTR? 28.38.19.212.in-addr.arpa. (54)
15:54:35.089529 IP 10.0.0.2.domain > ns1.59386: 29820 1/0/1 PTR ns3.telemaxx.net. (84)
15:54:35.645582 IP dns.telia.lv.42655 > ns1.domain: 49938 [1au] A? www.probe_28632.iotsecproject.tech. (63)
15:54:35.645749 IP ns1.domain > dns.telia.lv.42655: 49938 NXDomain*- 0/1/1 (109)
15:54:35.687808 IP 212.195.48.81.20023 > ns1.domain: 9146% [1au] A? www.probe_31759.iotsecproject.tech. (63)
15:54:35.687976 IP ns1.domain > 212.195.48.81.20023: 9146 NXDomain*- 0/1/1 (109)
15:54:35.727649 IP ns1.telemaxx.net.60349 > ns1.domain: 5144 [1au] A? www.probe_34798.iotsecproject.tech. (63)
15:54:35.727827 IP ns1.domain > ns1.telemaxx.net.60349: 5144 NXDomain*- 0/1/1 (109)
15:54:35.805288 IP ns1.46699 > 10.0.0.2.domain: 57715+ [1au] PTR? 34.240.19.194.in-addr.arpa. (55)
15:54:36.201243 IP 10.0.0.2.domain > ns1.46699: 57715 1/0/1 PTR dns.telia.lv. (81)
15:54:36.201680 IP ns1.60336 > 10.0.0.2.domain: 35568+ [1au] PTR? 81.48.195.212.in-addr.arpa. (55)
15:54:36.406234 IP 10.0.0.2.domain > ns1.60336: 35568 NXDomain 0/1/1 (138)
15:54:36.406774 IP ns1.60336 > 10.0.0.2.domain: 35568+ PTR? 81.48.195.212.in-addr.arpa. (44)
15:54:36.407096 IP 10.0.0.2.domain > ns1.60336: 35568 NXDomain 0/1/0 (127)
15:54:36.407510 IP ns1.35633 > 10.0.0.2.domain: 2659+ [1au] PTR? 10.0.144.213.in-addr.arpa. (54)
15:54:36.639794 IP 10.0.0.2.domain > ns1.35633: 2659 1/0/1 PTR ns1.telemaxx.net. (84)
15:54:36.673272 IP 125.201.249.67.37497 > ns1.domain: 65424 [1au] A? www.probe_28915.iotsecproject.tech. (63)
15:54:36.673431 IP ns1.domain > 125.201.249.67.37497: 65424 NXDomain*- 0/1/1 (109)
15:54:36.829313 IP ns1.55627 > 10.0.0.2.domain: 28773+ [1au] PTR? 67.249.201.125.in-addr.arpa. (56)
15:54:37.076228 IP 10.0.0.2.domain > ns1.55627: 28773 NXDomain 0/1/1 (120)
15:54:37.076572 IP ns1.55627 > 10.0.0.2.domain: 28773+ PTR? 67.249.201.125.in-addr.arpa. (45)
15:54:37.076969 IP 10.0.0.2.domain > ns1.55627: 28773 NXDomain 0/1/0 (109)
15:54:37.114176 IP dns2.muc7.m-online.net.33274 > ns1.domain: 597% [1au] A? probe_22386.iotsecproject.tech. (59)
15:54:37.114340 IP ns1.domain > dns2.muc7.m-online.net.33274: 597 NXDomain*- 0/1/1 (105)
15:54:37.114363 IP dns2.muc7.m-online.net.11912 > ns1.domain: 14782% [1au] A? ns2.iotsecproject.tech. (51)
15:54:37.114458 IP ns1.domain > dns2.muc7.m-online.net.11912: 14782*- 1/2/2 A 18.222.233.237 (115)
15:54:37.114486 IP dns2.muc7.m-online.net.33581 > ns1.domain: 57561% [1au] A? ns1.iotsecproject.tech. (51)
15:54:37.114529 IP ns1.domain > dns2.muc7.m-online.net.33581: 57561*- 1/2/2 A 18.222.233.237 (115)
15:54:37.226966 IP dns2.muc7.m-online.net.15753 > ns1.domain: 38287% [1au] AAAA? ns1.iotsecproject.tech. (51)
15:54:37.227117 IP ns1.domain > dns2.muc7.m-online.net.15753: 38287*- 0/1/1 (93)
15:54:37.236190 IP dns2.muc7.m-online.net.13153 > ns1.domain: 43615% [1au] A? www.probe_22386.iotsecproject.tech. (63)
15:54:37.236291 IP ns1.domain > dns2.muc7.m-online.net.13153: 43615 NXDomain*- 0/1/1 (109)
15:54:37.236418 IP dns2.muc7.m-online.net.5808 > ns1.domain: 41727% [1au] AAAA? ns2.iotsecproject.tech. (51)
15:54:37.236465 IP ns1.domain > dns2.muc7.m-online.net.5808: 41727*- 0/1/1 (97)
15:54:37.286400 IP 172.69.129.35.19528 > ns1.domain: 16619 [1au] NS? probe_26939.iotsecproject.tech. (59)
15:54:37.286560 IP ns1.domain > 172.69.129.35.19528: 16619 NXDomain*- 0/1/1 (105)
15:54:37.368862 IP dns1.muc7.m-online.net.46099 > ns1.domain: 13857% [1au] A? ns2.iotsecproject.tech. (51)
15:54:37.368924 IP dns1.muc7.m-online.net.62491 > ns1.domain: 3062% [1au] A? probe_22386.iotsecproject.tech. (59)
15:54:37.369039 IP ns1.domain > dns1.muc7.m-online.net.46099: 13857*- 1/2/2 A 18.222.233.237 (115)
15:54:37.369090 IP ns1.domain > dns1.muc7.m-online.net.62491: 3062 NXDomain*- 0/1/1 (105)
15:54:37.369122 IP dns1.muc7.m-online.net.52773 > ns1.domain: 24400% [1au] A? ns1.iotsecproject.tech. (51)
15:54:37.369167 IP ns1.domain > dns1.muc7.m-online.net.52773: 24400*- 1/2/2 A 18.222.233.237 (115)
15:54:37.441160 IP 172.69.129.35.50785 > ns1.domain: 2831 [1au] A? www.probe_26939.iotsecproject.tech. (63)
15:54:37.441322 IP ns1.domain > 172.69.129.35.50785: 2831 NXDomain*- 0/1/1 (109)
15:54:37.479104 IP dns1.muc7.m-online.net.38140 > ns1.domain: 9329% [1au] A? www.probe_22386.iotsecproject.tech. (63)
15:54:37.479288 IP ns1.domain > dns1.muc7.m-online.net.38140: 9329 NXDomain*- 0/1/1 (109)
15:54:37.490847 IP dns1.muc7.m-online.net.sgi-cmsd > ns1.domain: 13715% [1au] AAAA? ns1.iotsecproject.tech. (51)
15:54:37.490896 IP dns1.muc7.m-online.net.31995 > ns1.domain: 45785% [1au] AAAA? ns2.iotsecproject.tech. (51)
15:54:37.490960 IP ns1.domain > dns1.muc7.m-online.net.sgi-cmsd: 13715*- 0/1/1 (93)
15:54:37.491001 IP ns1.domain > dns1.muc7.m-online.net.31995: 45785*- 0/1/1 (97)
15:54:37.711153 IP resolv0.cl.cam.ac.uk.46568 > ns1.domain: 50395 [1au] A? www.probe_35509.iotsecproject.tech. (75)
15:54:37.711334 IP ns1.domain > resolv0.cl.cam.ac.uk.46568: 50395 NXDomain*- 0/1/1 (137)
15:54:37.852981 ARP, Request who-has 10.0.0.2 tell ns1, length 28
15:54:37.853084 ARP, Reply 10.0.0.2 is-at 06:6f:f1:1b:20:c0 (oui Unknown), length 42
15:54:37.853447 IP ns1.ssh > 147.178.6.131.27575: Flags [P.], seq 1249:1489, ack 864, win 331, length 240
15:54:37.853616 IP ns1.42889 > 10.0.0.2.domain: 65515+ [1au] PTR? 133.242.114.212.in-addr.arpa. (57)
15:54:37.920240 IP 172.68.13.74.13051 > ns1.domain: 48595 [1au] NS? probe_14011.iotsecproject.tech. (59)
15:54:37.920396 IP ns1.domain > 172.68.13.74.13051: 48595 NXDomain*- 0/1/1 (105)
15:54:37.997325 IP 10.0.0.2.domain > ns1.42889: 65515 1/0/1 PTR dns2.muc7.m-online.net. (93)
15:54:37.997792 IP ns1.50635 > 10.0.0.2.domain: 64279+ [1au] PTR? 35.129.69.172.in-addr.arpa. (55)
15:54:38.010361 IP 10.0.0.2.domain > ns1.50635: 64279 NXDomain 0/1/1 (109)
15:54:38.010868 IP ns1.50635 > 10.0.0.2.domain: 64279+ PTR? 35.129.69.172.in-addr.arpa. (44)
15:54:38.011333 IP 10.0.0.2.domain > ns1.50635: 64279 NXDomain 0/1/0 (98)
15:54:38.011747 IP ns1.59396 > 10.0.0.2.domain: 576+ [1au] PTR? 132.242.114.212.in-addr.arpa. (57)
15:54:38.063058 IP 172.68.13.74.46136 > ns1.domain: 64766 [1au] A? www.probe_14011.iotsecproject.tech. (63)
15:54:38.063220 IP ns1.domain > 172.68.13.74.46136: 64766 NXDomain*- 0/1/1 (109)
15:54:38.070539 IP 147.178.6.131.27575 > ns1.ssh: Flags [.], ack 1489, win 256, length 0
15:54:38.222372 IP 10.0.0.2.domain > ns1.59396: 576 1/0/1 PTR dns1.muc7.m-online.net. (93)
15:54:38.222843 IP ns1.41760 > 10.0.0.2.domain: 46843+ [1au] PTR? 1.1.232.128.in-addr.arpa. (53)
15:54:38.351549 IP 10.0.0.2.domain > ns1.41760: 46843 1/0/1 PTR resolv0.cl.cam.ac.uk. (87)
15:54:38.401520 IP ip-217.146.115.154.merula.net.1537 > ns1.domain: 57521% [1au] A? www.probe_14587.iotsecproject.tech. (63)
15:54:38.401674 IP ns1.domain > ip-217.146.115.154.merula.net.1537: 57521 NXDomain*- 0/1/1 (109)
15:54:38.443732 IP de-str01c-dnsr-05-qs.str.unity-media.net.32597 > ns1.domain: 25798 [1au] A? www.probe_29216.iotsecproject.tech. (91)
15:54:38.443908 IP ns1.domain > de-str01c-dnsr-05-qs.str.unity-media.net.32597: 25798 NXDomain*- 0/1/1 (137)
15:54:38.469575 IP de-fra04c-dnsr-05-qs.fra.unity-media.net.63885 > ns1.domain: 59443 [1au] A? www.probe_11299.iotsecproject.tech. (75)
15:54:38.469754 IP ns1.domain > de-fra04c-dnsr-05-qs.fra.unity-media.net.63885: 59443 NXDomain*- 0/1/1 (137)
15:54:38.587903 IP de-str01c-dnsr-03-qs.str.unity-media.net.61055 > ns1.domain: 58494 [1au] A? www.probe_29216.iotsecproject.tech. (91)
15:54:38.588090 IP ns1.domain > de-str01c-dnsr-03-qs.str.unity-media.net.61055: 58494 NXDomain*- 0/1/1 (137)
15:54:38.877333 IP ns1.34383 > 10.0.0.2.domain: 51119+ [1au] PTR? 74.13.68.172.in-addr.arpa. (54)
15:54:38.906857 IP 10.0.0.2.domain > ns1.34383: 51119 NXDomain 0/1/1 (108)
15:54:38.907244 IP ns1.34383 > 10.0.0.2.domain: 51119+ PTR? 74.13.68.172.in-addr.arpa. (43)
15:54:38.907680 IP 10.0.0.2.domain > ns1.34383: 51119 NXDomain 0/1/0 (97)
15:54:38.908465 IP ns1.ssh > 147.178.6.131.27575: Flags [P.], seq 1489:1777, ack 864, win 331, length 288
15:54:38.908603 IP ns1.47349 > 10.0.0.2.domain: 4436+ [1au] PTR? 154.115.146.217.in-addr.arpa. (57)
15:54:38.969420 IP ns1.acelerate.com.16649 > ns1.domain: 22391 [1au] A? www.probe_35003.iotsecproject.tech. (63)
15:54:38.969589 IP ns1.domain > ns1.acelerate.com.16649: 22391 NXDomain*- 0/1/1 (109)
15:54:39.141305 IP 147.178.6.131.27575 > ns1.ssh: Flags [.], ack 1777, win 255, length 0
15:54:39.148678 IP 74.125.190.25.44111 > ns1.domain: 20867% [1au] A? www.probe_30630.iotsecproject.tech. (78)
15:54:39.148847 IP ns1.domain > 74.125.190.25.44111: 20867 NXDomain*- 0/1/1 (124)
15:54:39.186423 IP 10.0.0.2.domain > ns1.47349: 4436 1/0/1 PTR ip-217.146.115.154.merula.net. (100)
15:54:39.186746 IP 74.125.181.2.46550 > ns1.domain: 20597% [1au] A? www.probe_21926.iotsecproject.tech. (74)
15:54:39.186872 IP ns1.domain > 74.125.181.2.46550: 20597 NXDomain*- 0/1/1 (120)
15:54:39.187045 IP ns1.51989 > 10.0.0.2.domain: 32009+ [1au] PTR? 90.160.210.81.in-addr.arpa. (55)
15:54:39.189223 IP 74.125.47.139.57413 > ns1.domain: 34395% [1au] A? www.probe_21926.iotsecproject.tech. (74)
15:54:39.189295 IP ns1.domain > 74.125.47.139.57413: 34395 NXDomain*- 0/1/1 (120)
15:54:39.251685 IP 66.185.121.243.63594 > ns1.domain: 64470% [1au] A? www.probe_21926.iotsecproject.tech. (63)
15:54:39.251862 IP ns1.domain > 66.185.121.243.63594: 64470 NXDomain*- 0/1/1 (109)
15:54:39.257271 IP 66.185.121.243.14010 > ns1.domain: 33399% [1au] AAAA? ns2.iotsecproject.tech. (51)
15:54:39.257287 IP 66.185.121.243.62332 > ns1.domain: 58907% [1au] AAAA? ns1.iotsecproject.tech. (51)
15:54:39.257348 IP ns1.domain > 66.185.121.243.14010: 33399*- 0/1/1 (97)
15:54:39.257380 IP ns1.domain > 66.185.121.243.62332: 58907*- 0/1/1 (93)
15:54:39.320410 IP 10.0.0.2.domain > ns1.51989: 32009 1/0/1 PTR de-str01c-dnsr-05-qs.str.unity-media.net. (109)
15:54:39.320843 IP ns1.40674 > 10.0.0.2.domain: 55323+ [1au] PTR? 26.160.210.81.in-addr.arpa. (55)
15:54:39.363963 IP 41.242.168.20.46635 > ns1.domain: 33778% [1au] A? www.probe_29035.iotsecproject.tech. (63)
15:54:39.364129 IP ns1.domain > 41.242.168.20.46635: 33778 NXDomain*- 0/1/1 (109)
15:54:39.370696 IP 66.185.121.243.24812 > ns1.domain: 48312% [1au] A? ns1.iotsecproject.TECH. (51)
15:54:39.370704 IP 66.185.121.243.11808 > ns1.domain: 50453% [1au] A? ns2.iotsecproject.TECH. (51)
15:54:39.370778 IP ns1.domain > 66.185.121.243.24812: 48312*- 1/2/2 A 18.222.233.237 (137)
15:54:39.370825 IP ns1.domain > 66.185.121.243.11808: 50453*- 1/2/2 A 18.222.233.237 (137)
15:54:39.375631 IP 66.185.121.243.5366 > ns1.domain: 33667% [1au] NS? iotsecproject.TECH. (47)
15:54:39.375691 IP ns1.domain > 66.185.121.243.5366: 33667*- 2/0/3 NS ns2.iotsecproject.tech., NS ns1.iotsecproject.tech. (133)
15:54:39.390550 IP ns1.sahara.com.sa.42587 > ns1.domain: 5381 [1au] A? www.probe_20923.iotsecproject.tech. (75)
15:54:39.390633 IP ns1.domain > ns1.sahara.com.sa.42587: 5381 NXDomain*- 0/1/1 (137)
15:54:39.401736 IP nsp-bz1.interbusiness.it.59189 > ns1.domain: 53080 [1au] A? www.probe_21265.iotsecproject.tech. (63)
15:54:39.401829 IP ns1.domain > nsp-bz1.interbusiness.it.59189: 53080 NXDomain*- 0/1/1 (109)
15:54:39.434163 IP MAA-RecursiveAnycastDNS-srv1.Spectranet.in.53379 > ns1.domain: 12494 [1au] A? www.probe_25845.iotsecproject.tech. (75)
15:54:39.434337 IP ns1.domain > MAA-RecursiveAnycastDNS-srv1.Spectranet.in.53379: 12494 NXDomain*- 0/1/1 (137)
15:54:39.435796 IP ns2.acttv.in.14415 > ns1.domain: 4058 [1au] A? www.probe_25845.iotsecproject.tech. (63)
15:54:39.435857 IP ns1.domain > ns2.acttv.in.14415: 4058 NXDomain*- 0/1/1 (109)
15:54:39.515039 IP 10.0.0.2.domain > ns1.40674: 55323 1/0/1 PTR de-fra04c-dnsr-05-qs.fra.unity-media.net. (109)
15:54:39.515466 IP ns1.53775 > 10.0.0.2.domain: 40212+ [1au] PTR? 88.160.210.81.in-addr.arpa. (55)
15:54:39.602676 IP 41.242.168.20.35618 > ns1.domain: 61460% [1au] AAAA? ns1.iotsecproject.tech. (51)
15:54:39.602715 IP 41.242.168.20.20809 > ns1.domain: 19357% [1au] AAAA? ns2.iotsecproject.tech. (51)
15:54:39.602825 IP 74.125.47.148.37737 > ns1.domain: 52352% [1au] A? www.probe_11299.iotsecproject.tech. (74)
15:54:39.602853 IP ns1.domain > 41.242.168.20.35618: 61460*- 0/1/1 (93)
15:54:39.602897 IP ns1.domain > 41.242.168.20.20809: 19357*- 0/1/1 (97)
15:54:39.602940 IP ns1.domain > 74.125.47.148.37737: 52352 NXDomain*- 0/1/1 (120)
15:54:39.622395 IP 41.242.168.20.37300 > ns1.domain: 47394% [1au] NS? iotsecproject.TECH. (47)
15:54:39.622482 IP ns1.domain > 41.242.168.20.37300: 47394*- 2/0/3 NS ns1.iotsecproject.tech., NS ns2.iotsecproject.tech. (133)
15:54:39.622712 IP 41.242.168.20.51658 > ns1.domain: 18605% [1au] A? ns2.iotsecproject.TECH. (51)
15:54:39.622760 IP ns1.domain > 41.242.168.20.51658: 18605*- 1/2/2 A 18.222.233.237 (137)
15:54:39.624992 IP resolv1.cl.cam.ac.uk.38298 > ns1.domain: 59012 [1au] A? www.probe_35509.iotsecproject.tech. (63)
15:54:39.625049 IP ns1.domain > resolv1.cl.cam.ac.uk.38298: 59012 NXDomain*- 0/1/1 (109)
15:54:39.633101 IP 41.242.168.20.20370 > ns1.domain: 20656% [1au] A? ns1.iotsecproject.TECH. (51)
15:54:39.633169 IP ns1.domain > 41.242.168.20.20370: 20656*- 1/2/2 A 18.222.233.237 (137)
15:54:39.639796 IP 10.0.0.2.domain > ns1.53775: 40212 1/0/1 PTR de-str01c-dnsr-03-qs.str.unity-media.net. (109)
15:54:39.901303 IP ns1.45096 > 10.0.0.2.domain: 39686+ [1au] PTR? 40.128.105.200.in-addr.arpa. (56)
15:54:40.057398 IP athe-dns5.otenet.gr.16374 > ns1.domain: 8122% [1au] A? www.probe_33106.iotsecproject.tech. (63)
15:54:40.057567 IP ns1.domain > athe-dns5.otenet.gr.16374: 8122 NXDomain*- 0/1/1 (109)
15:54:40.058862 IP nyma-dns6.otenet.gr.1783 > ns1.domain: 45003% [1au] A? www.probe_33106.iotsecproject.tech. (63)
15:54:40.058948 IP ns1.domain > nyma-dns6.otenet.gr.1783: 45003 NXDomain*- 0/1/1 (109)
15:54:40.064940 IP athe-dns1.otenet.gr.46458 > ns1.domain: 15608% [1au] A? www.probe_33106.iotsecproject.tech. (63)
15:54:40.065014 IP ns1.domain > athe-dns1.otenet.gr.46458: 15608 NXDomain*- 0/1/1 (109)
15:54:40.069673 IP nyma-dns5.otenet.gr.6726 > ns1.domain: 585% [1au] A? www.probe_33106.iotsecproject.tech. (63)
15:54:40.069752 IP ns1.domain > nyma-dns5.otenet.gr.6726: 585 NXDomain*- 0/1/1 (109)
15:54:40.400164 IP 162.158.161.238.33324 > ns1.domain: 52961 [1au] NS? probe_30630.iotsecproject.tech. (59)
15:54:40.400321 IP ns1.domain > 162.158.161.238.33324: 52961 NXDomain*- 0/1/1 (105)
15:54:40.599912 IP 162.158.161.238.26270 > ns1.domain: 52961 [1au] NS? probe_30630.iotsecproject.tech. (59)
15:54:40.600076 IP ns1.domain > 162.158.161.238.26270: 52961 NXDomain*- 0/1/1 (105)
15:54:40.606876 IP m45.ams.opendns.com.50046 > ns1.domain: 16267 [1au] A? www.probe_15009.iotsecproject.tech. (63)
15:54:40.606976 IP ns1.domain > m45.ams.opendns.com.50046: 16267 NXDomain*- 0/1/1 (109)
15:54:40.632122 IP 162.158.161.238.13455 > ns1.domain: 48599 [1au] A? www.probe_30630.iotsecproject.tech. (63)
15:54:40.632270 IP ns1.domain > 162.158.161.238.13455: 48599 NXDomain*- 0/1/1 (109)
15:54:40.775596 IP 162.158.161.238.40920 > ns1.domain: 48599 [1au] A? www.probe_30630.iotsecproject.tech. (63)
15:54:40.775756 IP ns1.domain > 162.158.161.238.40920: 48599 NXDomain*- 0/1/1 (109)
15:54:40.788087 IP ns13.sahara.com.sa.6376 > ns1.domain: 16636 [1au] A? www.probe_20923.iotsecproject.tech. (63)
15:54:40.788183 IP ns1.domain > ns13.sahara.com.sa.6376: 16636 NXDomain*- 0/1/1 (109)
15:54:40.831459 IP 162.158.161.238 > ns1: ICMP 162.158.161.238 udp port 26270 unreachable, length 141
15:54:40.900136 IP ns1.45096 > 10.0.0.2.domain: 39686+ [1au] PTR? 40.128.105.200.in-addr.arpa. (56)
15:54:40.994687 IP 141.101.68.148.57615 > ns1.domain: 7074 [1au] NS? probe_12392.iotsecproject.tech. (59)
15:54:40.994847 IP ns1.domain > 141.101.68.148.57615: 7074 NXDomain*- 0/1/1 (105)
15:54:41.006835 IP 162.158.161.238 > ns1: ICMP 162.158.161.238 udp port 40920 unreachable, length 145
15:54:41.095354 IP 141.101.68.148.33923 > ns1.domain: 970 [1au] A? www.probe_12392.iotsecproject.tech. (63)
15:54:41.095516 IP ns1.domain > 141.101.68.148.33923: 970 NXDomain*- 0/1/1 (109)
15:54:41.108126 IP m29.lon.opendns.com.41705 > ns1.domain: 53828 [1au] A? www.probe_27097.iotsecproject.tech. (63)
15:54:41.108214 IP ns1.domain > m29.lon.opendns.com.41705: 53828 NXDomain*- 0/1/1 (109)
15:54:41.109519 IP athe-dns2.otenet.gr.35465 > ns1.domain: 18550% [1au] A? www.probe_32684.iotsecproject.tech. (63)
15:54:41.109578 IP ns1.domain > athe-dns2.otenet.gr.35465: 18550 NXDomain*- 0/1/1 (109)
15:54:41.119903 IP 10.0.0.2.domain > ns1.45096: 39686 1/0/1 PTR ns1.acelerate.com. (87)
15:54:41.119918 IP 10.0.0.2.domain > ns1.45096: 39686 1/0/1 PTR ns1.acelerate.com. (87)
15:54:41.120298 IP ns1.59088 > 10.0.0.2.domain: 65281+ [1au] PTR? 25.190.125.74.in-addr.arpa. (55)
15:54:41.140379 IP 10.0.0.2.domain > ns1.59088: 65281 NXDomain 0/1/1 (115)
15:54:41.140480 IP ns1.59088 > 10.0.0.2.domain: 65281+ PTR? 25.190.125.74.in-addr.arpa. (44)
15:54:41.140808 IP 10.0.0.2.domain > ns1.59088: 65281 NXDomain 0/1/0 (104)
15:54:41.141428 IP ns1.33772 > 10.0.0.2.domain: 6392+ [1au] PTR? 2.181.125.74.in-addr.arpa. (54)
15:54:41.161096 IP 10.0.0.2.domain > ns1.33772: 6392 NXDomain 0/1/1 (114)
15:54:41.161218 IP ns1.33772 > 10.0.0.2.domain: 6392+ PTR? 2.181.125.74.in-addr.arpa. (43)
15:54:41.161585 IP 10.0.0.2.domain > ns1.33772: 6392 NXDomain 0/1/0 (103)
15:54:41.161961 IP ns1.59720 > 10.0.0.2.domain: 15343+ [1au] PTR? 139.47.125.74.in-addr.arpa. (55)
15:54:41.186398 IP 10.0.0.2.domain > ns1.59720: 15343 NXDomain 0/1/1 (115)
15:54:41.186513 IP ns1.59720 > 10.0.0.2.domain: 15343+ PTR? 139.47.125.74.in-addr.arpa. (44)
15:54:41.186939 IP 10.0.0.2.domain > ns1.59720: 15343 NXDomain 0/1/0 (104)
15:54:41.187302 IP ns1.37834 > 10.0.0.2.domain: 40832+ [1au] PTR? 243.121.185.66.in-addr.arpa. (56)
15:54:41.213087 IP res300.ams.rrdns.pch.net.38054 > ns1.domain: 2713 [1au] A? www.probe_35667.iotsecproject.tech. (63)
15:54:41.213232 IP ns1.domain > res300.ams.rrdns.pch.net.38054: 2713 NXDomain*- 0/1/1 (109)
15:54:41.309966 IP 10.0.0.2.domain > ns1.37834: 40832 NXDomain 0/1/1 (114)
15:54:41.310328 IP ns1.37834 > 10.0.0.2.domain: 40832+ PTR? 243.121.185.66.in-addr.arpa. (45)
15:54:41.310766 IP 10.0.0.2.domain > ns1.37834: 40832 NXDomain 0/1/0 (103)
15:54:41.311169 IP ns1.55611 > 10.0.0.2.domain: 14945+ [1au] PTR? 20.168.242.41.in-addr.arpa. (55)
15:54:41.415110 IP 74.125.46.10.50060 > ns1.domain: 55068% [1au] A? www.probe_14086.iotsecproject.tech. (74)
15:54:41.415279 IP ns1.domain > 74.125.46.10.50060: 55068 NXDomain*- 0/1/1 (120)
15:54:41.432383 IP ns1.jonaz.nl.16886 > ns1.domain: 25881% [1au] A? www.probe_13316.iotsecproject.tech. (63)
15:54:41.432530 IP ns1.domain > ns1.jonaz.nl.16886: 25881 NXDomain*- 0/1/1 (109)
15:54:41.475349 IP ns2.jonaz.nl.2383 > ns1.domain: 57206% [1au] A? www.probe_13316.iotsecproject.tech. (63)
15:54:41.475514 IP ns1.domain > ns2.jonaz.nl.2383: 57206 NXDomain*- 0/1/1 (109)
15:54:41.505922 IP nyma-dns9.otenet.gr.54696 > ns1.domain: 45970% [1au] A? www.probe_32684.iotsecproject.tech. (63)
15:54:41.506090 IP ns1.domain > nyma-dns9.otenet.gr.54696: 45970 NXDomain*- 0/1/1 (109)
15:54:41.567880 IP namunu.learn.ac.lk.61753 > ns1.domain: 29097 [1au] A? www.probe_18729.iotsecproject.tech. (63)
15:54:41.568047 IP ns1.domain > namunu.learn.ac.lk.61753: 29097 NXDomain*- 0/1/1 (109)
15:54:41.579215 IP 74.125.47.7.46895 > ns1.domain: 32008% [1au] A? www.probe_34960.iotsecproject.tech. (74)
15:54:41.579288 IP ns1.domain > 74.125.47.7.46895: 32008 NXDomain*- 0/1/1 (120)
15:54:41.675867 IP 10.0.0.2.domain > ns1.55611: 14945 NXDomain 0/1/1 (116)
15:54:41.676243 IP ns1.55611 > 10.0.0.2.domain: 14945+ PTR? 20.168.242.41.in-addr.arpa. (44)
15:54:41.676630 IP 10.0.0.2.domain > ns1.55611: 14945 NXDomain 0/1/0 (105)
15:54:41.677258 IP ns1.ssh > 147.178.6.131.27575: Flags [P.], seq 1777:2145, ack 864, win 331, length 368
15:54:41.677397 IP ns1.51122 > 10.0.0.2.domain: 17148+ [1au] PTR? 200.68.76.212.in-addr.arpa. (55)
15:54:41.724722 IP 173.194.98.15.57847 > ns1.domain: 30491% [1au] A? www.probe_16512.iotsecproject.tech. (74)
15:54:41.724894 IP ns1.domain > 173.194.98.15.57847: 30491 NXDomain*- 0/1/1 (120)
15:54:41.727601 IP m49.lon.opendns.com.40378 > ns1.domain: 38899 [1au] A? www.probe_15009.iotsecproject.tech. (63)
15:54:41.727677 IP ns1.domain > m49.lon.opendns.com.40378: 38899 NXDomain*- 0/1/1 (109)
15:54:41.732004 IP 5.199.177.27.33582 > ns1.domain: 27196% [1au] A? www.probe_19675.iotsecproject.tech. (63)
15:54:41.732071 IP ns1.domain > 5.199.177.27.33582: 27196 NXDomain*- 0/1/1 (109)
15:54:41.739874 IP 5.199.177.27.34996 > ns1.domain: 45402% [1au] NS? iotsecproject.TECH. (47)
15:54:41.739921 IP 5.199.177.27.14475 > ns1.domain: 21304% [1au] A? ns1.iotsecproject.TECH. (51)
15:54:41.739985 IP ns1.domain > 5.199.177.27.34996: 45402*- 2/0/3 NS ns1.iotsecproject.tech., NS ns2.iotsecproject.tech. (133)
15:54:41.740034 IP 5.199.177.27.56132 > ns1.domain: 47747% [1au] A? ns2.iotsecproject.TECH. (51)
15:54:41.740039 IP ns1.domain > 5.199.177.27.14475: 21304*- 1/2/2 A 18.222.233.237 (137)
15:54:41.740077 IP ns1.domain > 5.199.177.27.56132: 47747*- 1/2/2 A 18.222.233.237 (137)
15:54:41.740258 IP 5.199.177.27.18527 > ns1.domain: 38762% [1au] AAAA? ns2.iotsecproject.tech. (51)
15:54:41.740302 IP ns1.domain > 5.199.177.27.18527: 38762*- 0/1/1 (97)
15:54:41.741514 IP 5.199.177.27.8348 > ns1.domain: 31469% [1au] AAAA? ns1.iotsecproject.tech. (51)
15:54:41.741563 IP ns1.domain > 5.199.177.27.8348: 31469*- 0/1/1 (93)
15:54:41.816203 IP 10.0.0.2.domain > ns1.51122: 17148 1/0/1 PTR ns1.sahara.com.sa. (86)
15:54:41.816647 IP ns1.44358 > 10.0.0.2.domain: 23359+ [1au] PTR? 56.17.37.85.in-addr.arpa. (53)
15:54:41.839634 IP 91.204.23.3.46047 > ns1.domain: 3389 [1au] A? www.probe_11270.iotsecproject.tech. (63)
15:54:41.839769 IP ns1.domain > 91.204.23.3.46047: 3389 NXDomain*- 0/1/1 (109)
15:54:41.885482 IP 172.217.32.136.59865 > ns1.domain: 12888% [1au] A? www.probe_30630.iotsecproject.tech. (74)
15:54:41.885643 IP ns1.domain > 172.217.32.136.59865: 12888 NXDomain*- 0/1/1 (120)
15:54:41.900701 IP 147.178.6.131.27575 > ns1.ssh: Flags [.], ack 2145, win 254, length 0
15:54:41.904779 IP resolv2.cl.cam.ac.uk.1815 > ns1.domain: 32211% [1au] A? www.probe_35509.iotsecproject.tech. (63)
15:54:41.904871 IP ns1.domain > resolv2.cl.cam.ac.uk.1815: 32211 NXDomain*- 0/1/1 (109)
15:54:41.986926 IP nyma-dns8.otenet.gr.22574 > ns1.domain: 40962% [1au] A? www.probe_32684.iotsecproject.tech. (63)
15:54:41.987091 IP ns1.domain > nyma-dns8.otenet.gr.22574: 40962 NXDomain*- 0/1/1 (109)
15:54:42.030004 IP nyma-dns7.otenet.gr.34029 > ns1.domain: 13442% [1au] A? www.probe_32684.iotsecproject.tech. (63)
15:54:42.030168 IP ns1.domain > nyma-dns7.otenet.gr.34029: 13442 NXDomain*- 0/1/1 (109)
15:54:42.034014 IP 74.125.73.84.59363 > ns1.domain: 41456% [1au] A? www.probe_20923.iotsecproject.tech. (74)
15:54:42.034073 IP ns1.domain > 74.125.73.84.59363: 41456 NXDomain*- 0/1/1 (120)
15:54:42.062524 IP 10.0.0.2.domain > ns1.44358: 23359 1/0/1 PTR nsp-bz1.interbusiness.it. (91)
15:54:42.062940 IP ns1.41540 > 10.0.0.2.domain: 50032+ [1au] PTR? 66.112.82.119.in-addr.arpa. (55)
15:54:42.119603 IP dns-out-207.highway.telekom.at.54764 > ns1.domain: 45978 [1au] A? www.probe_21402.iotsecproject.tech. (63)
15:54:42.119761 IP ns1.domain > dns-out-207.highway.telekom.at.54764: 45978 NXDomain*- 0/1/1 (109)
15:54:42.122122 IP dns-out-201.highway.telekom.at.23154 > ns1.domain: 4285 [1au] A? www.probe_21402.iotsecproject.tech. (63)
15:54:42.122249 IP ns1.domain > dns-out-201.highway.telekom.at.23154: 4285 NXDomain*- 0/1/1 (109)
15:54:42.209148 IP 141.101.66.184.27519 > ns1.domain: 61665 [1au] NS? probe_12392.iotsecproject.tech. (59)
15:54:42.209302 IP ns1.domain > 141.101.66.184.27519: 61665 NXDomain*- 0/1/1 (105)
15:54:42.222642 IP m37.lon.opendns.com.55661 > ns1.domain: 37181 [1au] A? www.probe_27097.iotsecproject.tech. (63)
15:54:42.222786 IP ns1.domain > m37.lon.opendns.com.55661: 37181 NXDomain*- 0/1/1 (109)
15:54:42.291345 IP 10.0.0.2.domain > ns1.41540: 50032 1/0/1 PTR MAA-RecursiveAnycastDNS-srv1.Spectranet.in. (111)
15:54:42.291773 IP ns1.57705 > 10.0.0.2.domain: 37662+ [1au] PTR? 12.21.83.202.in-addr.arpa. (54)
15:54:42.309741 IP 141.101.66.184.24053 > ns1.domain: 44051 [1au] A? www.probe_12392.iotsecproject.tech. (63)
15:54:42.309878 IP ns1.domain > 141.101.66.184.24053: 44051 NXDomain*- 0/1/1 (109)
15:54:42.530361 IP 10.0.0.2.domain > ns1.57705: 37662 1/0/1 PTR ns2.acttv.in. (80)
15:54:42.530818 IP ns1.52067 > 10.0.0.2.domain: 13875+ [1au] PTR? 148.47.125.74.in-addr.arpa. (55)
15:54:42.541321 IP nsrec-5.volia.net.39177 > ns1.domain: 49800 [1au] A? www.probe_12017.iotsecproject.tech. (63)
15:54:42.541452 IP ns1.domain > nsrec-5.volia.net.39177: 49800 NXDomain*- 0/1/1 (109)
15:54:42.551469 IP 10.0.0.2.domain > ns1.52067: 13875 NXDomain 0/1/1 (115)
15:54:42.551560 IP ns1.52067 > 10.0.0.2.domain: 13875+ PTR? 148.47.125.74.in-addr.arpa. (44)
15:54:42.551926 IP 10.0.0.2.domain > ns1.52067: 13875 NXDomain 0/1/0 (104)
15:54:42.552365 IP ns1.56354 > 10.0.0.2.domain: 46468+ [1au] PTR? 2.1.232.128.in-addr.arpa. (53)
15:54:42.600885 IP 74.125.46.4.59024 > ns1.domain: 14075% [1au] A? www.probe_14086.iotsecproject.tech. (74)
15:54:42.601054 IP ns1.domain > 74.125.46.4.59024: 14075 NXDomain*- 0/1/1 (120)
15:54:42.651913 IP 10.0.0.2.domain > ns1.56354: 46468 1/0/1 PTR resolv1.cl.cam.ac.uk. (87)
15:54:42.652451 IP ns1.34960 > 10.0.0.2.domain: 44315+ [1au] PTR? 190.72.235.83.in-addr.arpa. (55)
15:54:42.718304 IP 74.125.47.152.65435 > ns1.domain: 62651% [1au] A? www.probe_34960.iotsecproject.tech. (74)
15:54:42.718470 IP ns1.domain > 74.125.47.152.65435: 62651 NXDomain*- 0/1/1 (120)
