15:34:21.324838 IP ns1.ssh > 147.178.6.131.27196: Flags [P.], seq 4291288191:4291288239, ack 3228876625, win 314, length 48
15:34:21.324887 IP ns1.ssh > 147.178.6.131.27196: Flags [P.], seq 48:96, ack 1, win 314, length 48
15:34:21.325271 IP ns1.ssh > 147.178.6.131.27196: Flags [P.], seq 96:144, ack 1, win 314, length 48
15:34:21.325324 IP ns1.ssh > 147.178.6.131.27196: Flags [P.], seq 144:192, ack 1, win 314, length 48
15:34:21.507348 IP 147.178.6.131.27196 > ns1.ssh: Flags [.], ack 192, win 253, length 0
15:34:22.331204 ARP, Request who-has ns1 tell _gateway, length 42
15:34:22.331218 ARP, Reply ns1 is-at 06:9e:a4:f5:8b:82 (oui Unknown), length 28
15:34:22.333484 IP ns1.43525 > 10.0.0.2.domain: 13541+ [1au] PTR? 131.6.178.147.in-addr.arpa. (55)
15:34:22.540956 IP 10.0.0.2.domain > ns1.43525: 13541 NXDomain 0/1/1 (113)
15:34:22.541093 IP ns1.43525 > 10.0.0.2.domain: 13541+ PTR? 131.6.178.147.in-addr.arpa. (44)
15:34:22.541596 IP 10.0.0.2.domain > ns1.43525: 13541 NXDomain 0/1/0 (102)
15:34:27.484952 ARP, Request who-has 10.0.0.2 tell ns1, length 28
15:34:27.485094 ARP, Reply 10.0.0.2 is-at 06:6f:f1:1b:20:c0 (oui Unknown), length 42
15:34:56.329232 IP 112.85.42.229.31759 > ns1.ssh: Flags [S], seq 2948678106, win 29200, options [mss 1460,sackOK,TS val 1145581171 ecr 0,nop,wscale 7], length 0
15:34:56.329261 IP ns1.ssh > 112.85.42.229.31759: Flags [S.], seq 2020946846, ack 2948678107, win 26847, options [mss 8961,sackOK,TS val 168894855 ecr 1145581171,nop,wscale 7], length 0
15:34:56.810676 IP 112.85.42.229.31759 > ns1.ssh: Flags [.], ack 1, win 229, options [nop,nop,TS val 1145581292 ecr 168894855], length 0
15:34:56.815325 IP ns1.ssh > 112.85.42.229.31759: Flags [P.], seq 1:42, ack 1, win 210, options [nop,nop,TS val 168895341 ecr 1145581292], length 41
15:34:56.873821 IP 112.85.42.229.31759 > ns1.ssh: Flags [P.], seq 1:16, ack 1, win 229, options [nop,nop,TS val 1145581308 ecr 168894855], length 15
15:34:56.873850 IP ns1.ssh > 112.85.42.229.31759: Flags [.], ack 16, win 210, options [nop,nop,TS val 168895400 ecr 1145581308], length 0
15:34:57.149293 IP ns1.52851 > 10.0.0.2.domain: 9848+ [1au] PTR? 229.42.85.112.in-addr.arpa. (55)
15:34:57.150624 IP 10.0.0.2.domain > ns1.52851: 9848 NXDomain 0/1/1 (109)
15:34:57.150689 IP ns1.52851 > 10.0.0.2.domain: 9848+ PTR? 229.42.85.112.in-addr.arpa. (44)
15:34:57.151018 IP 10.0.0.2.domain > ns1.52851: 9848 NXDomain 0/1/0 (98)
15:34:57.290786 IP 112.85.42.229.31759 > ns1.ssh: Flags [.], ack 42, win 229, options [nop,nop,TS val 1145581412 ecr 168895341], length 0
15:34:57.290808 IP ns1.ssh > 112.85.42.229.31759: Flags [P.], seq 42:1122, ack 16, win 210, options [nop,nop,TS val 168895817 ecr 1145581412], length 1080
15:34:57.476816 IP 112.85.42.229.31759 > ns1.ssh: Flags [P.], seq 16:664, ack 42, win 229, options [nop,nop,TS val 1145581458 ecr 168895400], length 648
15:34:57.476836 IP ns1.ssh > 112.85.42.229.31759: Flags [.], ack 664, win 220, options [nop,nop,TS val 168896003 ecr 1145581458], length 0
15:34:57.784467 IP 112.85.42.229.31759 > ns1.ssh: Flags [.], ack 1122, win 245, options [nop,nop,TS val 1145581533 ecr 168895817], length 0
15:34:58.097872 IP 112.85.42.229.31759 > ns1.ssh: Flags [P.], seq 664:936, ack 1122, win 245, options [nop,nop,TS val 1145581614 ecr 168896003], length 272
15:34:58.097892 IP ns1.ssh > 112.85.42.229.31759: Flags [.], ack 936, win 230, options [nop,nop,TS val 168896624 ecr 1145581614], length 0
15:34:58.100043 IP ns1.ssh > 112.85.42.229.31759: Flags [P.], seq 1122:1970, ack 936, win 230, options [nop,nop,TS val 168896626 ecr 1145581614], length 848
15:34:58.593720 IP 112.85.42.229.31759 > ns1.ssh: Flags [.], ack 1970, win 262, options [nop,nop,TS val 1145581737 ecr 168896626], length 0
15:35:00.073987 IP 112.85.42.229.31759 > ns1.ssh: Flags [P.], seq 936:952, ack 1970, win 262, options [nop,nop,TS val 1145582107 ecr 168896626], length 16
15:35:00.116959 IP ns1.ssh > 112.85.42.229.31759: Flags [.], ack 952, win 230, options [nop,nop,TS val 168898643 ecr 1145582107], length 0
15:35:00.622438 IP 112.85.42.229.31759 > ns1.ssh: Flags [P.], seq 952:1004, ack 1970, win 262, options [nop,nop,TS val 1145582245 ecr 168898643], length 52
15:35:00.622466 IP ns1.ssh > 112.85.42.229.31759: Flags [.], ack 1004, win 230, options [nop,nop,TS val 168899148 ecr 1145582245], length 0
15:35:00.622550 IP ns1.ssh > 112.85.42.229.31759: Flags [P.], seq 1970:2022, ack 1004, win 230, options [nop,nop,TS val 168899148 ecr 1145582245], length 52
15:35:01.104576 IP 112.85.42.229.31759 > ns1.ssh: Flags [.], ack 2022, win 262, options [nop,nop,TS val 1145582365 ecr 168899148], length 0
15:35:02.632338 IP 112.85.42.229.31759 > ns1.ssh: Flags [P.], seq 1004:1072, ack 2022, win 262, options [nop,nop,TS val 1145582747 ecr 168899148], length 68
15:35:02.634032 IP ns1.ssh > 112.85.42.229.31759: Flags [P.], seq 2022:2074, ack 1072, win 230, options [nop,nop,TS val 168901160 ecr 1145582747], length 52
15:35:03.121000 IP 112.85.42.229.31759 > ns1.ssh: Flags [.], ack 2074, win 262, options [nop,nop,TS val 1145582869 ecr 168901160], length 0
15:35:03.190452 IP 112.85.42.229.31759 > ns1.ssh: Flags [P.], seq 1072:1124, ack 2074, win 262, options [nop,nop,TS val 1145582887 ecr 168901160], length 52
15:35:03.190474 IP 112.85.42.229.31759 > ns1.ssh: Flags [F.], seq 1124, ack 2074, win 262, options [nop,nop,TS val 1145582887 ecr 168901160], length 0
15:35:03.192106 IP ns1.ssh > 112.85.42.229.31759: Flags [F.], seq 2074, ack 1125, win 230, options [nop,nop,TS val 168901718 ecr 1145582887], length 0
15:35:03.681177 IP 112.85.42.229.31759 > ns1.ssh: Flags [.], ack 2075, win 262, options [nop,nop,TS val 1145583009 ecr 168901718], length 0
15:35:19.539795 ARP, Request who-has ns1 tell _gateway, length 42
15:35:19.539810 ARP, Reply ns1 is-at 06:9e:a4:f5:8b:82 (oui Unknown), length 28
15:35:33.839083 IP 38.21.241.233.58435 > ns1.domain: 63387+% [1au] TXT? c9-11.com. (38)
15:35:33.839276 IP ns1.domain > 38.21.241.233.58435: 63387 Refused- 0/0/1 (38)
15:35:34.013424 IP ns1.60652 > 10.0.0.2.domain: 35848+ [1au] PTR? 233.241.21.38.in-addr.arpa. (55)
15:35:34.150502 IP 10.0.0.2.domain > ns1.60652: 35848 NXDomain 0/1/1 (113)
15:35:34.150616 IP ns1.60652 > 10.0.0.2.domain: 35848+ PTR? 233.241.21.38.in-addr.arpa. (44)
15:35:34.151043 IP 10.0.0.2.domain > ns1.60652: 35848 NXDomain 0/1/0 (102)
15:35:39.164968 ARP, Request who-has 10.0.0.2 tell ns1, length 28
15:35:39.165085 ARP, Reply 10.0.0.2 is-at 06:6f:f1:1b:20:c0 (oui Unknown), length 42
15:36:21.572425 ARP, Request who-has ns1 tell _gateway, length 42
15:36:21.572440 ARP, Reply ns1 is-at 06:9e:a4:f5:8b:82 (oui Unknown), length 28
15:36:53.602783 IP 147.178.6.131.27575 > ns1.ssh: Flags [P.], seq 1508764007:1508764071, ack 432350460, win 255, length 64
15:36:53.602990 IP ns1.ssh > 147.178.6.131.27575: Flags [P.], seq 1:97, ack 64, win 331, length 96
15:36:53.823397 IP 147.178.6.131.27575 > ns1.ssh: Flags [.], ack 97, win 255, length 0
15:36:54.408490 IP 147.178.6.131.27575 > ns1.ssh: Flags [P.], seq 64:112, ack 97, win 255, length 48
15:36:54.410108 IP ns1.ssh > 147.178.6.131.27575: Flags [P.], seq 97:145, ack 112, win 331, length 48
15:36:54.627709 IP 147.178.6.131.27575 > ns1.ssh: Flags [.], ack 145, win 255, length 0
15:37:12.034628 IP 147.178.6.131.27575 > ns1.ssh: Flags [P.], seq 112:160, ack 145, win 255, length 48
15:37:12.034788 IP ns1.ssh > 147.178.6.131.27575: Flags [P.], seq 145:193, ack 160, win 331, length 48
15:37:12.041274 IP ns1.ssh > 147.178.6.131.27575: Flags [P.], seq 193:241, ack 160, win 331, length 48
15:37:12.218209 IP 147.178.6.131.27575 > ns1.ssh: Flags [.], ack 241, win 255, length 0
15:37:13.369960 IP 147.178.6.131.27575 > ns1.ssh: Flags [P.], seq 160:208, ack 241, win 255, length 48
15:37:13.370167 IP ns1.ssh > 147.178.6.131.27575: Flags [P.], seq 241:289, ack 208, win 331, length 48
15:37:13.506258 IP 147.178.6.131.27575 > ns1.ssh: Flags [P.], seq 208:256, ack 241, win 255, length 48
15:37:13.506447 IP ns1.ssh > 147.178.6.131.27575: Flags [P.], seq 289:337, ack 256, win 331, length 48
15:37:13.589969 IP 147.178.6.131.27575 > ns1.ssh: Flags [.], ack 289, win 254, length 0
15:37:13.722894 IP 147.178.6.131.27575 > ns1.ssh: Flags [.], ack 337, win 254, length 0
15:37:14.177285 IP 147.178.6.131.27575 > ns1.ssh: Flags [P.], seq 256:304, ack 337, win 254, length 48
15:37:14.177481 IP ns1.ssh > 147.178.6.131.27575: Flags [P.], seq 337:385, ack 304, win 331, length 48
15:37:14.329944 IP 147.178.6.131.27575 > ns1.ssh: Flags [P.], seq 304:352, ack 337, win 254, length 48
15:37:14.330136 IP ns1.ssh > 147.178.6.131.27575: Flags [P.], seq 385:433, ack 352, win 331, length 48
15:37:14.398413 IP 147.178.6.131.27575 > ns1.ssh: Flags [.], ack 385, win 254, length 0
15:37:14.440798 IP 147.178.6.131.27575 > ns1.ssh: Flags [P.], seq 352:400, ack 385, win 254, length 48
15:37:14.441019 IP ns1.ssh > 147.178.6.131.27575: Flags [P.], seq 433:481, ack 400, win 331, length 48
15:37:14.548364 IP 147.178.6.131.27575 > ns1.ssh: Flags [.], ack 433, win 254, length 0
15:37:14.659830 IP 147.178.6.131.27575 > ns1.ssh: Flags [.], ack 481, win 254, length 0
15:37:14.985659 IP 147.178.6.131.27575 > ns1.ssh: Flags [P.], seq 400:448, ack 481, win 254, length 48
15:37:14.985850 IP ns1.ssh > 147.178.6.131.27575: Flags [P.], seq 481:529, ack 448, win 331, length 48
15:37:15.203637 IP 147.178.6.131.27575 > ns1.ssh: Flags [.], ack 529, win 253, length 0
15:37:15.474283 IP 147.178.6.131.27575 > ns1.ssh: Flags [P.], seq 448:496, ack 529, win 253, length 48
15:37:15.474473 IP ns1.ssh > 147.178.6.131.27575: Flags [P.], seq 529:577, ack 496, win 331, length 48
15:37:15.642216 IP 147.178.6.131.27575 > ns1.ssh: Flags [P.], seq 496:544, ack 529, win 253, length 48
15:37:15.642403 IP ns1.ssh > 147.178.6.131.27575: Flags [P.], seq 577:625, ack 544, win 331, length 48
15:37:15.692431 IP 147.178.6.131.27575 > ns1.ssh: Flags [.], ack 577, win 253, length 0
15:37:15.861784 IP 147.178.6.131.27575 > ns1.ssh: Flags [.], ack 625, win 253, length 0
15:37:18.257952 IP 147.178.6.131.27575 > ns1.ssh: Flags [P.], seq 544:592, ack 625, win 253, length 48
15:37:18.258142 IP ns1.ssh > 147.178.6.131.27575: Flags [P.], seq 625:673, ack 592, win 331, length 48
15:37:18.410201 IP 147.178.6.131.27575 > ns1.ssh: Flags [P.], seq 592:640, ack 625, win 253, length 48
15:37:18.410388 IP ns1.ssh > 147.178.6.131.27575: Flags [P.], seq 673:721, ack 640, win 331, length 48
15:37:18.474882 IP 147.178.6.131.27575 > ns1.ssh: Flags [.], ack 673, win 253, length 0
15:37:18.629601 IP 147.178.6.131.27575 > ns1.ssh: Flags [.], ack 721, win 253, length 0
15:37:18.706075 IP 147.178.6.131.27575 > ns1.ssh: Flags [P.], seq 640:688, ack 721, win 253, length 48
15:37:18.706275 IP ns1.ssh > 147.178.6.131.27575: Flags [P.], seq 721:769, ack 688, win 331, length 48
15:37:18.813056 ARP, Request who-has ns1 tell _gateway, length 42
15:37:18.813070 ARP, Reply ns1 is-at 06:9e:a4:f5:8b:82 (oui Unknown), length 28
15:37:18.925965 IP 147.178.6.131.27575 > ns1.ssh: Flags [.], ack 769, win 252, length 0
15:37:19.026087 IP 147.178.6.131.27575 > ns1.ssh: Flags [P.], seq 688:736, ack 769, win 252, length 48
15:37:19.026276 IP ns1.ssh > 147.178.6.131.27575: Flags [P.], seq 769:817, ack 736, win 331, length 48
15:37:19.137612 IP 147.178.6.131.27575 > ns1.ssh: Flags [P.], seq 736:784, ack 769, win 252, length 48
15:37:19.141748 IP ns1.ssh > 147.178.6.131.27575: Flags [P.], seq 817:865, ack 784, win 331, length 48
15:37:19.244797 IP 147.178.6.131.27575 > ns1.ssh: Flags [.], ack 817, win 252, length 0
15:37:19.361329 IP 147.178.6.131.27575 > ns1.ssh: Flags [.], ack 865, win 252, length 0
15:37:20.057060 IP 147.178.6.131.27575 > ns1.ssh: Flags [P.], seq 784:832, ack 865, win 252, length 48
15:37:20.057231 IP ns1.ssh > 147.178.6.131.27575: Flags [P.], seq 865:913, ack 832, win 331, length 48
15:37:20.058585 IP ns1.ssh > 147.178.6.131.27575: Flags [P.], seq 913:977, ack 832, win 331, length 64
15:37:20.058639 IP ns1.ssh > 147.178.6.131.27575: Flags [P.], seq 977:1025, ack 832, win 331, length 48
15:37:20.058936 IP ns1.ssh > 147.178.6.131.27575: Flags [P.], seq 1025:1089, ack 832, win 331, length 64
15:37:20.236496 IP 147.178.6.131.27575 > ns1.ssh: Flags [.], ack 1089, win 251, length 0
15:37:22.394298 IP 147.178.6.131.27575 > ns1.ssh: Flags [P.], seq 832:880, ack 1089, win 251, length 48
15:37:22.394495 IP ns1.ssh > 147.178.6.131.27575: Flags [P.], seq 1089:1137, ack 880, win 331, length 48
15:37:22.513865 IP 147.178.6.131.27575 > ns1.ssh: Flags [P.], seq 880:928, ack 1089, win 251, length 48
15:37:22.514057 IP ns1.ssh > 147.178.6.131.27575: Flags [P.], seq 1137:1185, ack 928, win 331, length 48
15:37:22.612954 IP 147.178.6.131.27575 > ns1.ssh: Flags [.], ack 1137, win 251, length 0
15:37:22.731592 IP 147.178.6.131.27575 > ns1.ssh: Flags [.], ack 1185, win 251, length 0
15:37:23.345909 IP 147.178.6.131.27575 > ns1.ssh: Flags [P.], seq 928:976, ack 1185, win 251, length 48
15:37:23.346105 IP ns1.ssh > 147.178.6.131.27575: Flags [P.], seq 1185:1233, ack 976, win 331, length 48
15:37:23.565763 IP 147.178.6.131.27575 > ns1.ssh: Flags [.], ack 1233, win 251, length 0
15:37:23.618425 IP 147.178.6.131.27575 > ns1.ssh: Flags [P.], seq 976:1024, ack 1233, win 251, length 48
15:37:23.618618 IP ns1.ssh > 147.178.6.131.27575: Flags [P.], seq 1233:1281, ack 1024, win 331, length 48
15:37:23.835531 IP 147.178.6.131.27575 > ns1.ssh: Flags [.], ack 1281, win 250, length 0
15:37:23.853205 IP 147.178.6.131.27575 > ns1.ssh: Flags [P.], seq 1024:1072, ack 1281, win 250, length 48
15:37:23.853385 IP ns1.ssh > 147.178.6.131.27575: Flags [P.], seq 1281:1329, ack 1072, win 331, length 48
15:37:24.073507 IP 147.178.6.131.27575 > ns1.ssh: Flags [.], ack 1329, win 256, length 0
15:37:24.354259 IP 147.178.6.131.27575 > ns1.ssh: Flags [P.], seq 1072:1120, ack 1329, win 256, length 48
15:37:24.354448 IP ns1.ssh > 147.178.6.131.27575: Flags [P.], seq 1329:1377, ack 1120, win 331, length 48
15:37:24.573769 IP 147.178.6.131.27575 > ns1.ssh: Flags [.], ack 1377, win 256, length 0
15:37:24.608829 IP 147.178.6.131.27575 > ns1.ssh: Flags [P.], seq 1120:1168, ack 1377, win 256, length 48
15:37:24.609018 IP ns1.ssh > 147.178.6.131.27575: Flags [P.], seq 1377:1425, ack 1168, win 331, length 48
15:37:24.761375 IP 147.178.6.131.27575 > ns1.ssh: Flags [P.], seq 1168:1216, ack 1377, win 256, length 48
15:37:24.766524 IP ns1.ssh > 147.178.6.131.27575: Flags [P.], seq 1425:1473, ack 1216, win 331, length 48
15:37:24.829537 IP 147.178.6.131.27575 > ns1.ssh: Flags [.], ack 1425, win 256, length 0
15:37:24.986017 IP 147.178.6.131.27575 > ns1.ssh: Flags [.], ack 1473, win 256, length 0
15:37:25.337100 IP 147.178.6.131.27575 > ns1.ssh: Flags [P.], seq 1216:1264, ack 1473, win 256, length 48
15:37:25.337266 IP ns1.ssh > 147.178.6.131.27575: Flags [P.], seq 1473:1521, ack 1264, win 331, length 48
15:37:25.338922 IP ns1.ssh > 147.178.6.131.27575: Flags [P.], seq 1521:1601, ack 1264, win 331, length 80
15:37:25.338967 IP ns1.ssh > 147.178.6.131.27575: Flags [P.], seq 1601:1649, ack 1264, win 331, length 48
15:37:25.339283 IP ns1.ssh > 147.178.6.131.27575: Flags [P.], seq 1649:1697, ack 1264, win 331, length 48
15:37:25.519949 IP 147.178.6.131.27575 > ns1.ssh: Flags [.], ack 1697, win 255, length 0
15:37:27.153881 IP 147.178.6.131.27575 > ns1.ssh: Flags [P.], seq 1264:1312, ack 1697, win 255, length 48
15:37:27.154086 IP ns1.ssh > 147.178.6.131.27575: Flags [P.], seq 1697:1761, ack 1312, win 331, length 64
15:37:27.374288 IP 147.178.6.131.27575 > ns1.ssh: Flags [.], ack 1761, win 254, length 0
15:37:27.809820 IP 147.178.6.131.27575 > ns1.ssh: Flags [P.], seq 1312:1376, ack 1761, win 254, length 64
15:37:27.810023 IP ns1.ssh > 147.178.6.131.27575: Flags [P.], seq 1761:1809, ack 1376, win 331, length 48
15:37:27.986181 IP 147.178.6.131.27575 > ns1.ssh: Flags [P.], seq 1376:1424, ack 1761, win 254, length 48
15:37:27.986386 IP ns1.ssh > 147.178.6.131.27575: Flags [P.], seq 1809:1857, ack 1424, win 331, length 48
15:37:28.029046 IP 147.178.6.131.27575 > ns1.ssh: Flags [.], ack 1809, win 254, length 0
15:37:28.205778 IP 147.178.6.131.27575 > ns1.ssh: Flags [.], ack 1857, win 254, length 0
15:37:29.266034 IP 147.178.6.131.27575 > ns1.ssh: Flags [P.], seq 1424:1472, ack 1857, win 254, length 48
15:37:29.266339 IP ns1.ssh > 147.178.6.131.27575: Flags [P.], seq 1857:1921, ack 1472, win 331, length 64
15:37:29.362038 IP 147.178.6.131.27575 > ns1.ssh: Flags [P.], seq 1472:1520, ack 1857, win 254, length 48
15:37:29.362329 IP ns1.ssh > 147.178.6.131.27575: Flags [P.], seq 1921:1969, ack 1520, win 331, length 48
15:37:29.483009 IP 147.178.6.131.27575 > ns1.ssh: Flags [.], ack 1921, win 254, length 0
15:37:29.509120 IP 147.178.6.131.27575 > ns1.ssh: Flags [P.], seq 1520:1568, ack 1921, win 254, length 48
15:37:29.509403 IP ns1.ssh > 147.178.6.131.27575: Flags [P.], seq 1969:2017, ack 1568, win 331, length 48
15:37:29.586961 IP 147.178.6.131.27575 > ns1.ssh: Flags [.], ack 1969, win 254, length 0
15:37:29.731787 IP 147.178.6.131.27575 > ns1.ssh: Flags [.], ack 2017, win 253, length 0
15:37:29.914601 IP 147.178.6.131.27575 > ns1.ssh: Flags [P.], seq 1568:1616, ack 2017, win 253, length 48
15:37:29.915109 IP ns1.ssh > 147.178.6.131.27575: Flags [P.], seq 2017:2065, ack 1616, win 331, length 48
15:37:29.916547 IP ns1.ssh > 147.178.6.131.27575: Flags [P.], seq 2065:2129, ack 1616, win 331, length 64
15:37:29.916601 IP ns1.ssh > 147.178.6.131.27575: Flags [P.], seq 2129:2177, ack 1616, win 331, length 48
15:37:29.916908 IP ns1.ssh > 147.178.6.131.27575: Flags [P.], seq 2177:2225, ack 1616, win 331, length 48
15:37:30.096399 IP 147.178.6.131.27575 > ns1.ssh: Flags [.], ack 2225, win 253, length 0
15:37:31.826479 IP 147.178.6.131.27575 > ns1.ssh: Flags [P.], seq 1616:1664, ack 2225, win 253, length 48
15:37:31.826683 IP ns1.ssh > 147.178.6.131.27575: Flags [P.], seq 2225:2289, ack 1664, win 331, length 64
15:37:31.956270 IP 147.178.6.131.27575 > ns1.ssh: Flags [P.], seq 1664:1712, ack 2225, win 253, length 48
15:37:31.956570 IP ns1.ssh > 147.178.6.131.27575: Flags [P.], seq 2289:2353, ack 1712, win 331, length 64
15:37:32.125859 IP 147.178.6.131.27575 > ns1.ssh: Flags [.], ack 2289, win 252, length 0
15:37:32.146951 IP 147.178.6.131.27575 > ns1.ssh: Flags [P.], seq 1712:1760, ack 2353, win 252, length 48
15:37:32.147254 IP ns1.ssh > 147.178.6.131.27575: Flags [P.], seq 2353:2417, ack 1760, win 331, length 64
15:37:32.572988 IP ns1.ssh > 147.178.6.131.27575: Flags [P.], seq 2353:2417, ack 1760, win 331, length 64
15:37:32.582668 IP 147.178.6.131.27575 > ns1.ssh: Flags [.], ack 2417, win 252, length 0
15:37:32.586400 IP 147.178.6.131.27575 > ns1.ssh: Flags [P.], seq 1760:1808, ack 2417, win 252, length 48
15:37:32.586654 IP ns1.ssh > 147.178.6.131.27575: Flags [P.], seq 2417:2481, ack 1808, win 331, length 64
15:37:32.755447 IP 147.178.6.131.27575 > ns1.ssh: Flags [.], ack 2417, win 252, options [nop,nop,sack 1 {2353:2417}], length 0
15:37:32.805946 IP 147.178.6.131.27575 > ns1.ssh: Flags [.], ack 2481, win 252, length 0
15:37:33.648825 IP 147.178.6.131.27575 > ns1.ssh: Flags [P.], seq 1808:1856, ack 2481, win 252, length 48
15:37:33.649412 IP ns1.ssh > 147.178.6.131.27575: Flags [P.], seq 2481:2529, ack 1856, win 331, length 48
15:37:33.883580 IP 147.178.6.131.27575 > ns1.ssh: Flags [.], ack 2529, win 251, length 0
15:38:14.067235 ARP, Request who-has ns1 tell _gateway, length 42
15:38:14.067249 ARP, Reply ns1 is-at 06:9e:a4:f5:8b:82 (oui Unknown), length 28
15:38:28.648738 IP 172.217.47.10.36461 > ns1.domain: 59339% [1au] A? www.probe_17119.iotsecproject.tech. (74)
15:38:28.648908 IP ns1.domain > 172.217.47.10.36461: 59339 NXDomain*- 0/1/1 (120)
15:38:29.117415 IP ns1.42723 > 10.0.0.2.domain: 59129+ [1au] PTR? 10.47.217.172.in-addr.arpa. (55)
15:38:29.900132 IP ns1.42723 > 10.0.0.2.domain: 59129+ [1au] PTR? 10.47.217.172.in-addr.arpa. (55)
15:38:30.038317 IP 192.221.176.13.47818 > ns1.domain: 3865% [1au] A? www.probe_17119.iotsecproject.tech. (63)
15:38:30.038487 IP ns1.domain > 192.221.176.13.47818: 3865 NXDomain*- 0/1/1 (109)
15:38:31.650120 IP ns1.42723 > 10.0.0.2.domain: 59129+ [1au] PTR? 10.47.217.172.in-addr.arpa. (55)
15:38:32.318457 IP 10.0.0.2.domain > ns1.42723: 59129 ServFail 0/0/1 (55)
15:38:32.318478 IP 10.0.0.2.domain > ns1.42723: 59129 ServFail 0/0/1 (55)
15:38:32.318575 IP ns1.42723 > 10.0.0.2.domain: 59129+ PTR? 10.47.217.172.in-addr.arpa. (44)
15:38:32.319176 IP ns1.43206 > 10.0.0.2.domain: 28590+ [1au] PTR? 13.176.221.192.in-addr.arpa. (56)
15:38:32.394301 IP 10.0.0.2.domain > ns1.43206: 28590 NXDomain 0/1/1 (110)
15:38:32.394994 IP ns1.43206 > 10.0.0.2.domain: 28590+ PTR? 13.176.221.192.in-addr.arpa. (45)
15:38:32.395449 IP 10.0.0.2.domain > ns1.43206: 28590 NXDomain 0/1/0 (99)
15:38:33.213269 IP ns1.ssh > 147.178.6.131.27575: Flags [P.], seq 2529:2673, ack 1856, win 331, length 144
15:38:33.430432 IP 147.178.6.131.27575 > ns1.ssh: Flags [.], ack 2673, win 251, length 0
15:38:33.974170 IP ip-26.net-89-2-3.static.numericable.fr.46223 > ns1.domain: 35916 A? www.probe_27646.IotSecpRoJEct.tech. (52)
15:38:33.974190 IP ip-26.net-89-2-3.static.numericable.fr.23546 > ns1.domain: 21575 A? www.probe_27646.IotSecpRoJEct.tech. (52)
15:38:33.974330 IP ns1.domain > ip-26.net-89-2-3.static.numericable.fr.46223: 35916 NXDomain*- 0/1/0 (112)
15:38:33.974365 IP ns1.domain > ip-26.net-89-2-3.static.numericable.fr.23546: 21575 NXDomain*- 0/1/0 (112)
15:38:34.237259 IP ns1.49731 > 10.0.0.2.domain: 19862+ [1au] PTR? 26.3.2.89.in-addr.arpa. (51)
15:38:34.268941 ARP, Request who-has 10.0.0.2 tell ns1, length 28
15:38:34.269121 ARP, Reply 10.0.0.2 is-at 06:6f:f1:1b:20:c0 (oui Unknown), length 42
15:38:34.381142 IP 10.0.0.2.domain > ns1.49731: 19862 1/0/1 PTR ip-26.net-89-2-3.static.numericable.fr. (103)
15:38:34.850961 IP 10.0.0.2.domain > ns1.42723: 59129 ServFail 0/0/1 (55)
15:38:34.850990 IP ns1 > 10.0.0.2: ICMP ns1 udp port 42723 unreachable, length 91
15:38:34.850998 IP 10.0.0.2.domain > ns1.42723: 59129 ServFail 0/0/0 (44)
15:38:34.851001 IP ns1 > 10.0.0.2: ICMP ns1 udp port 42723 unreachable, length 80
15:38:35.221041 IP 47.92-221-128.customer.lyse.net.28594 > ns1.domain: 6242 [1au] A? www.probe_15928.iotsecproject.tech. (63)
15:38:35.221208 IP ns1.domain > 47.92-221-128.customer.lyse.net.28594: 6242 NXDomain*- 0/1/1 (109)
15:38:35.261293 IP ns1.54368 > 10.0.0.2.domain: 35613+ [1au] PTR? 47.128.221.92.in-addr.arpa. (55)
15:38:35.531693 IP 10.0.0.2.domain > ns1.54368: 35613 1/0/1 PTR 47.92-221-128.customer.lyse.net. (100)
15:38:35.604978 IP host-156.200.58.40-static.tedata.net.59638 > ns1.domain: 48271 [1au] A? www.probe_35074.iotsecproject.tech. (63)
15:38:35.605145 IP ns1.domain > host-156.200.58.40-static.tedata.net.59638: 48271 NXDomain*- 0/1/1 (109)
15:38:36.198140 IP res3.green.ch.43867 > ns1.domain: 29388% [1au] A? www.probe_16248.iotsecproject.tech. (63)
15:38:36.198306 IP ns1.domain > res3.green.ch.43867: 29388 NXDomain*- 0/1/1 (109)
15:38:36.219199 IP res3.green.ch.61505 > ns1.domain: 35097% [1au] NS? iotsecproject.tech. (47)
15:38:36.219211 IP res3.green.ch.9056 > ns1.domain: 44621% [1au] A? ns1.iotsecproject.TECH. (51)
15:38:36.219226 IP res3.green.ch.57586 > ns1.domain: 56529% [1au] A? ns2.iotsecproject.TECH. (51)
15:38:36.219335 IP ns1.domain > res3.green.ch.61505: 35097*- 2/0/3 NS ns2.iotsecproject.tech., NS ns1.iotsecproject.tech. (115)
15:38:36.219350 IP res3.green.ch.35944 > ns1.domain: 42819% [1au] AAAA? ns2.iotsecproject.tech. (51)
15:38:36.219400 IP ns1.domain > res3.green.ch.9056: 44621*- 1/2/2 A 18.222.233.237 (137)
15:38:36.219422 IP res3.green.ch.30351 > ns1.domain: 16845% [1au] AAAA? ns1.iotsecproject.tech. (51)
15:38:36.219445 IP ns1.domain > res3.green.ch.57586: 56529*- 1/2/2 A 18.222.233.237 (137)
15:38:36.219477 IP ns1.domain > res3.green.ch.35944: 42819*- 0/1/1 (97)
15:38:36.219501 IP ns1.domain > res3.green.ch.30351: 16845*- 0/1/1 (93)
15:38:36.285265 IP ns1.37869 > 10.0.0.2.domain: 33007+ [1au] PTR? 58.40.200.156.in-addr.arpa. (55)
15:38:36.494439 IP 10.0.0.2.domain > ns1.37869: 33007 1/0/1 PTR host-156.200.58.40-static.tedata.net. (105)
15:38:36.494887 IP ns1.44835 > 10.0.0.2.domain: 481+ [1au] PTR? 20.101.228.146.in-addr.arpa. (56)
15:38:36.610426 IP 10.0.0.2.domain > ns1.44835: 481 1/0/1 PTR res3.green.ch. (83)
15:38:36.834875 IP 5-148-67-204.cust-5.exponential-e.net.34480 > ns1.domain: 31177% [1au] A? www.probe_29560.iotsecproject.tech. (63)
15:38:36.834895 IP 5-148-67-204.cust-5.exponential-e.net.42251 > ns1.domain: 4541% [1au] AAAA? ns1.iotsecproject.tech. (51)
15:38:36.834998 IP 5-148-67-204.cust-5.exponential-e.net.38038 > ns1.domain: 39997% [1au] AAAA? ns2.iotsecproject.tech. (51)
15:38:36.835059 IP ns1.domain > 5-148-67-204.cust-5.exponential-e.net.34480: 31177 NXDomain*- 0/1/1 (109)
15:38:36.835103 IP ns1.domain > 5-148-67-204.cust-5.exponential-e.net.42251: 4541*- 0/1/1 (93)
15:38:36.835128 IP ns1.domain > 5-148-67-204.cust-5.exponential-e.net.38038: 39997*- 0/1/1 (97)
15:38:37.022346 IP 74.125.73.87.57404 > ns1.domain: 30899% [1au] A? www.probe_11563.iotsecproject.tech. (74)
15:38:37.022524 IP ns1.domain > 74.125.73.87.57404: 30899 NXDomain*- 0/1/1 (120)
15:38:37.036258 IP rsv01-peer.ib.routit.net.16483 > ns1.domain: 39210% [1au] A? www.probe_12765.iotsecproject.tech. (63)
15:38:37.036406 IP ns1.domain > rsv01-peer.ib.routit.net.16483: 39210 NXDomain*- 0/1/1 (109)
15:38:37.083458 IP res4.green.ch.62184 > ns1.domain: 25118% [1au] A? www.probe_16248.iotsecproject.tech. (63)
15:38:37.083634 IP ns1.domain > res4.green.ch.62184: 25118 NXDomain*- 0/1/1 (109)
15:38:37.089605 IP res4.green.ch.6876 > ns1.domain: 5796% [1au] A? ns1.iotsecproject.tech. (51)
15:38:37.089686 IP ns1.domain > res4.green.ch.6876: 5796*- 1/2/2 A 18.222.233.237 (115)
15:38:37.091218 IP res4.green.ch.21819 > ns1.domain: 45138% [1au] NS? iotsecproject.tech. (47)
15:38:37.091280 IP ns1.domain > res4.green.ch.21819: 45138*- 2/0/3 NS ns1.iotsecproject.tech., NS ns2.iotsecproject.tech. (115)
15:38:37.091359 IP res4.green.ch.17396 > ns1.domain: 21262% [1au] A? ns2.iotsecproject.tech. (51)
15:38:37.091402 IP ns1.domain > res4.green.ch.17396: 21262*- 1/2/2 A 18.222.233.237 (115)
15:38:37.096202 IP res4.green.ch.57623 > ns1.domain: 38759% [1au] AAAA? ns1.iotsecproject.tech. (51)
15:38:37.096251 IP ns1.domain > res4.green.ch.57623: 38759*- 0/1/1 (93)
15:38:37.096975 IP res4.green.ch.25030 > ns1.domain: 56869% [1au] AAAA? ns2.iotsecproject.tech. (51)
15:38:37.097019 IP ns1.domain > res4.green.ch.25030: 56869*- 0/1/1 (97)
15:38:37.162896 IP pubntp1.Frankfurt1.Level3.net.13642 > ns1.domain: 4880% [1au] A? www.probe_10921.iotsecproject.tech. (63)
15:38:37.163058 IP ns1.domain > pubntp1.Frankfurt1.Level3.net.13642: 4880 NXDomain*- 0/1/1 (109)
15:38:37.187678 IP de-str01c-dnsr-03-qs.str.unity-media.net.16632 > ns1.domain: 49393 [1au] A? www.probe_35663.iotsecproject.tech. (75)
15:38:37.187863 IP ns1.domain > de-str01c-dnsr-03-qs.str.unity-media.net.16632: 49393 NXDomain*- 0/1/1 (137)
15:38:37.309307 IP ns1.38111 > 10.0.0.2.domain: 40766+ [1au] PTR? 204.67.148.5.in-addr.arpa. (54)
15:38:37.483398 IP 10.0.0.2.domain > ns1.38111: 40766 1/0/1 PTR 5-148-67-204.cust-5.exponential-e.net. (105)
15:38:37.483982 IP ns1.ssh > 147.178.6.131.27575: Flags [P.], seq 2673:3057, ack 1856, win 331, length 384
15:38:37.484132 IP ns1.55393 > 10.0.0.2.domain: 1855+ [1au] PTR? 87.73.125.74.in-addr.arpa. (54)
15:38:37.504584 IP 10.0.0.2.domain > ns1.55393: 1855 NXDomain 0/1/1 (114)
15:38:37.505089 IP ns1.55393 > 10.0.0.2.domain: 1855+ PTR? 87.73.125.74.in-addr.arpa. (43)
15:38:37.505385 IP 10.0.0.2.domain > ns1.55393: 1855 NXDomain 0/1/0 (103)
15:38:37.505765 IP ns1.37764 > 10.0.0.2.domain: 55296+ [1au] PTR? 62.232.144.213.in-addr.arpa. (56)
15:38:37.694154 IP 10.0.0.2.domain > ns1.37764: 55296 1/0/1 PTR rsv01-peer.ib.routit.net. (94)
15:38:37.694583 IP ns1.40952 > 10.0.0.2.domain: 1788+ [1au] PTR? 28.101.228.146.in-addr.arpa. (56)
15:38:37.707041 IP 147.178.6.131.27575 > ns1.ssh: Flags [.], ack 3057, win 256, length 0
15:38:37.759756 IP dns2.ostnet.pl.40855 > ns1.domain: 55118 [1au] A? www.probe_33489.iotsecproject.tech. (63)
15:38:37.759920 IP ns1.domain > dns2.ostnet.pl.40855: 55118 NXDomain*- 0/1/1 (109)
15:38:37.862712 IP 10.0.0.2.domain > ns1.40952: 1788 1/0/1 PTR res4.green.ch. (83)
15:38:37.863184 IP ns1.33273 > 10.0.0.2.domain: 7670+ [1au] PTR? 128.18.0.8.in-addr.arpa. (52)
15:38:37.875211 IP 10.0.0.2.domain > ns1.33273: 7670 1/0/1 PTR pubntp1.Frankfurt1.Level3.net. (95)
15:38:37.875569 IP ns1.42629 > 10.0.0.2.domain: 41839+ [1au] PTR? 88.160.210.81.in-addr.arpa. (55)
15:38:38.105612 IP 10.0.0.2.domain > ns1.42629: 41839 1/0/1 PTR de-str01c-dnsr-03-qs.str.unity-media.net. (109)
15:38:38.123748 IP 62.34.202.139.41058 > ns1.domain: 41980% [1au] A? www.probe_20175.iotsecproject.tech. (63)
15:38:38.123892 IP ns1.domain > 62.34.202.139.41058: 41980 NXDomain*- 0/1/1 (109)
15:38:38.154314 IP 173.194.169.97.37077 > ns1.domain: 13537% [1au] A? www.probe_12765.iotsecproject.tech. (74)
15:38:38.154445 IP ns1.domain > 173.194.169.97.37077: 13537 NXDomain*- 0/1/1 (120)
15:38:38.333320 IP ns1.52761 > 10.0.0.2.domain: 57913+ [1au] PTR? 20.128.133.62.in-addr.arpa. (55)
15:38:38.336685 IP 162.158.83.42.43565 > ns1.domain: 22142 [1au] NS? probe_35663.iotsecproject.tech. (59)
15:38:38.336800 IP ns1.domain > 162.158.83.42.43565: 22142 NXDomain*- 0/1/1 (105)
15:38:38.376720 IP 74.125.47.135.48399 > ns1.domain: 32234% [1au] A? www.probe_30193.iotsecproject.tech. (74)
15:38:38.376894 IP ns1.domain > 74.125.47.135.48399: 32234 NXDomain*- 0/1/1 (120)
15:38:38.439752 IP 162.158.83.42.51789 > ns1.domain: 1604 [1au] A? www.probe_35663.iotsecproject.tech. (63)
15:38:38.439914 IP ns1.domain > 162.158.83.42.51789: 1604 NXDomain*- 0/1/1 (109)
15:38:38.546694 IP ns1.dodonet.it.54644 > ns1.domain: 53931 [1au] A? www.probe_19306.iotsecproject.tech. (63)
15:38:38.546872 IP ns1.domain > ns1.dodonet.it.54644: 53931 NXDomain*- 0/1/1 (109)
15:38:38.552322 IP 162.158.83.42.11440 > ns1.domain: 1604 [1au] A? www.probe_35663.iotsecproject.tech. (63)
15:38:38.552431 IP ns1.domain > 162.158.83.42.11440: 1604 NXDomain*- 0/1/1 (109)
15:38:38.609333 IP dns.jacobs-university.de.47490 > ns1.domain: 33115% [1au] A? www.probe_13994.iotsecproject.tech. (63)
15:38:38.609493 IP ns1.domain > dns.jacobs-university.de.47490: 33115 NXDomain*- 0/1/1 (109)
15:38:38.659417 IP 62.169.194.71.35384 > ns1.domain: 3142 A? www.probe_20600.iotsecproject.tech. (52)
15:38:38.659572 IP ns1.domain > 62.169.194.71.35384: 3142 NXDomain*- 0/1/0 (98)
15:38:38.664519 IP 162.158.83.42 > ns1: ICMP 162.158.83.42 udp port 11440 unreachable, length 145
15:38:38.696953 IP tserv1.bud1.he.net.37592 > ns1.domain: 31338 [1au] A? www.probe_10921.iotsecproject.tech. (63)
15:38:38.697123 IP ns1.domain > tserv1.bud1.he.net.37592: 31338 NXDomain*- 0/1/1 (109)
15:38:38.832113 IP 10.0.0.2.domain > ns1.52761: 57913 1/0/1 PTR dns2.ostnet.pl. (83)
15:38:38.832554 IP ns1.55569 > 10.0.0.2.domain: 37241+ [1au] PTR? 139.202.34.62.in-addr.arpa. (55)
15:38:38.929846 IP 10.0.0.2.domain > ns1.55569: 37241 NXDomain 0/1/1 (138)
15:38:38.930375 IP ns1.55569 > 10.0.0.2.domain: 37241+ PTR? 139.202.34.62.in-addr.arpa. (44)
15:38:38.930786 IP 10.0.0.2.domain > ns1.55569: 37241 NXDomain 0/1/0 (127)
15:38:38.931302 IP ns1.ssh > 147.178.6.131.27575: Flags [P.], seq 3057:3473, ack 1856, win 331, length 416
15:38:38.931439 IP ns1.34690 > 10.0.0.2.domain: 36677+ [1au] PTR? 97.169.194.173.in-addr.arpa. (56)
15:38:38.951832 IP 10.0.0.2.domain > ns1.34690: 36677 NXDomain 0/1/1 (116)
15:38:38.952184 IP ns1.34690 > 10.0.0.2.domain: 36677+ PTR? 97.169.194.173.in-addr.arpa. (45)
15:38:38.952558 IP 10.0.0.2.domain > ns1.34690: 36677 NXDomain 0/1/0 (105)
15:38:39.150507 IP 147.178.6.131.27575 > ns1.ssh: Flags [.], ack 3473, win 255, length 0
15:38:39.291481 IP resolver15.dns.sfr.net.14503 > ns1.domain: 7059 A? www.probe_34004.iotsecproject.tech. (52)
15:38:39.291641 IP ns1.domain > resolver15.dns.sfr.net.14503: 7059 NXDomain*- 0/1/0 (98)
15:38:39.295165 IP resolver09.dns.sfr.net.3555 > ns1.domain: 32336 A? www.probe_34004.iotsecproject.tech. (52)
15:38:39.295228 IP ns1.domain > resolver09.dns.sfr.net.3555: 32336 NXDomain*- 0/1/0 (98)
15:38:39.357413 IP ns1.42737 > 10.0.0.2.domain: 50229+ [1au] PTR? 42.83.158.162.in-addr.arpa. (55)
15:38:39.410491 IP h-dns-a11.isp.t-ipnet.de.4496 > ns1.domain: 46432 [1au] A? www.probe_22414.iotsecproject.tech. (63)
15:38:39.410655 IP ns1.domain > h-dns-a11.isp.t-ipnet.de.4496: 46432 NXDomain*- 0/1/1 (109)
15:38:39.600063 IP 111.87.4.236.44329 > ns1.domain: 61978 [1au] A? www.probe_34755.iotsecproject.tech. (63)
15:38:39.600233 IP ns1.domain > 111.87.4.236.44329: 61978 NXDomain*- 0/1/1 (109)
15:38:39.705207 IP hh-dns-a11.isp.t-ipnet.de.5330 > ns1.domain: 7239 [1au] A? www.probe_22414.iotsecproject.tech. (63)
15:38:39.705377 IP ns1.domain > hh-dns-a11.isp.t-ipnet.de.5330: 7239 NXDomain*- 0/1/1 (109)
15:38:39.896171 IP gate-02.vty.dailymotion.com.52558 > ns1.domain: 40641% [1au] A? probe_11227.iotsecproject.tech. (59)
15:38:39.896341 IP ns1.domain > gate-02.vty.dailymotion.com.52558: 40641 NXDomain*- 0/1/1 (105)
15:38:39.986454 IP gate-02.vty.dailymotion.com.46998 > ns1.domain: 43823% [1au] A? www.probe_11227.iotsecproject.tech. (63)
15:38:39.986621 IP ns1.domain > gate-02.vty.dailymotion.com.46998: 43823 NXDomain*- 0/1/1 (109)
15:38:40.150135 IP ns1.42737 > 10.0.0.2.domain: 50229+ [1au] PTR? 42.83.158.162.in-addr.arpa. (55)
15:38:40.216473 IP dnsint.jacobs-university.de.34191 > ns1.domain: 16337 [1au] A? www.probe_13994.iotsecproject.tech. (63)
15:38:40.216639 IP ns1.domain > dnsint.jacobs-university.de.34191: 16337 NXDomain*- 0/1/1 (109)
15:38:40.558157 IP ns2.umu.se.49035 > ns1.domain: 3997% [1au] A? www.probe_22505.iotsecproject.tech. (75)
15:38:40.558340 IP ns1.domain > ns2.umu.se.49035: 3997 NXDomain*- 0/1/1 (137)
15:38:40.570277 IP ns2.dodonet.it.37348 > ns1.domain: 16523 [1au] A? www.probe_19306.iotsecproject.tech. (63)
15:38:40.570385 IP ns1.domain > ns2.dodonet.it.37348: 16523 NXDomain*- 0/1/1 (109)
15:38:41.063854 IP 12.121.117.210.54506 > ns1.domain: 12364% [1au] A? www.probe_50307.iotsecproject.tech. (63)
15:38:41.064020 IP ns1.domain > 12.121.117.210.54506: 12364 NXDomain*- 0/1/1 (109)
15:38:41.195452 IP 10.0.0.2.domain > ns1.42737: 50229 ServFail 0/0/1 (55)
15:38:41.195472 IP 10.0.0.2.domain > ns1.42737: 50229 ServFail 0/0/1 (55)
15:38:41.195571 IP ns1.42737 > 10.0.0.2.domain: 50229+ PTR? 42.83.158.162.in-addr.arpa. (44)
15:38:41.196152 IP ns1.43335 > 10.0.0.2.domain: 49777+ [1au] PTR? 135.47.125.74.in-addr.arpa. (55)
15:38:41.215712 IP 10.0.0.2.domain > ns1.43335: 49777 NXDomain 0/1/1 (115)
15:38:41.216192 IP ns1.43335 > 10.0.0.2.domain: 49777+ PTR? 135.47.125.74.in-addr.arpa. (44)
15:38:41.216562 IP 10.0.0.2.domain > ns1.43335: 49777 NXDomain 0/1/0 (104)
15:38:41.216969 IP ns1.58667 > 10.0.0.2.domain: 32239+ [1au] PTR? 33.24.21.185.in-addr.arpa. (54)
15:38:41.277197 IP 173.194.169.67.40907 > ns1.domain: 49018% [1au] A? www.probe_28319.iotsecproject.tech. (74)
15:38:41.277372 IP ns1.domain > 173.194.169.67.40907: 49018 NXDomain*- 0/1/1 (120)
15:38:41.427139 IP syb-zero.sybcom.net.29414 > ns1.domain: 24526% [1au] A? www.probe_30703.iotsecproject.tech. (63)
15:38:41.427308 IP ns1.domain > syb-zero.sybcom.net.29414: 24526 NXDomain*- 0/1/1 (109)
15:38:41.535625 IP 10.0.0.2.domain > ns1.42737: 50229 ServFail 0/0/0 (44)
15:38:41.535652 IP ns1 > 10.0.0.2: ICMP ns1 udp port 42737 unreachable, length 80
15:38:41.645094 IP 10.0.0.2.domain > ns1.58667: 32239 1/0/1 PTR ns1.dodonet.it. (82)
15:38:41.645544 IP ns1.41730 > 10.0.0.2.domain: 39835+ [1au] PTR? 22.44.201.212.in-addr.arpa. (55)
15:38:41.815853 IP dns2-han6-p1.vodafone-ip.de.3818 > ns1.domain: 9549 [1au] A? www.probe_34492.iotsecproject.tech. (63)
15:38:41.816021 IP ns1.domain > dns2-han6-p1.vodafone-ip.de.3818: 9549 NXDomain*- 0/1/1 (109)
15:38:41.852083 IP 10.0.0.2.domain > ns1.41730: 39835 1/0/1 PTR dns.jacobs-university.de. (93)
15:38:41.852506 IP ns1.41438 > 10.0.0.2.domain: 37004+ [1au] PTR? 71.194.169.62.in-addr.arpa. (55)
15:38:41.940891 IP dns1-hmb6-p1.vodafone-ip.de.5297 > ns1.domain: 34786 [1au] A? www.probe_34492.iotsecproject.tech. (63)
15:38:41.941058 IP ns1.domain > dns1-hmb6-p1.vodafone-ip.de.5297: 34786 NXDomain*- 0/1/1 (109)
15:38:42.132189 IP 213.228.58.152.20327 > ns1.domain: 29641% [1au] AAAA? ns2.iotsecproject.tech. (51)
15:38:42.132347 IP ns1.domain > 213.228.58.152.20327: 29641*- 0/1/1 (97)
15:38:42.133101 IP 213.228.58.152.41782 > ns1.domain: 50186% [1au] AAAA? ns1.iotsecproject.tech. (51)
15:38:42.133156 IP ns1.domain > 213.228.58.152.41782: 50186*- 0/1/1 (93)
15:38:42.133416 IP 213.228.58.152.34032 > ns1.domain: 29018% [1au] A? www.probe_24584.iotsecproject.tech. (63)
15:38:42.133498 IP ns1.domain > 213.228.58.152.34032: 29018 NXDomain*- 0/1/1 (109)
15:38:42.194393 IP 12.121.117.218.58214 > ns1.domain: 46865% [1au] A? www.probe_50307.iotsecproject.tech. (63)
15:38:42.194565 IP ns1.domain > 12.121.117.218.58214: 46865 NXDomain*- 0/1/1 (109)
15:38:42.324796 IP 10.0.0.2.domain > ns1.41438: 37004 NXDomain 0/1/1 (110)
15:38:42.325354 IP ns1.41438 > 10.0.0.2.domain: 37004+ PTR? 71.194.169.62.in-addr.arpa. (44)
15:38:42.325798 IP 10.0.0.2.domain > ns1.41438: 37004 NXDomain 0/1/0 (99)
15:38:42.326177 IP ns1.53291 > 10.0.0.2.domain: 58303+ [1au] PTR? 14.87.66.216.in-addr.arpa. (54)
15:38:42.390998 IP softplus.net.65042 > ns1.domain: 59071 [1au] A? www.probe_22461.iotsecproject.tech. (63)
15:38:42.391164 IP ns1.domain > softplus.net.65042: 59071 NXDomain*- 0/1/1 (109)
15:38:42.433760 IP 10.0.0.2.domain > ns1.53291: 58303 1/0/1 PTR tserv1.bud1.he.net. (86)
15:38:42.434211 IP ns1.51300 > 10.0.0.2.domain: 33438+ [1au] PTR? 9.64.0.109.in-addr.arpa. (52)
15:38:42.442367 IP fw01.office.lon.exn.uk.18102 > ns1.domain: 47097% [1au] A? ns1.iotsecproject.tech. (51)
15:38:42.442491 IP ns1.domain > fw01.office.lon.exn.uk.18102: 47097*- 1/2/2 A 18.222.233.237 (115)
15:38:42.442540 IP fw01.office.lon.exn.uk.45151 > ns1.domain: 4003% [1au] A? probe_10027.iotsecproject.tech. (59)
15:38:42.442587 IP ns1.domain > fw01.office.lon.exn.uk.45151: 4003 NXDomain*- 0/1/1 (105)
15:38:42.442726 IP fw01.office.lon.exn.uk.34807 > ns1.domain: 37029% [1au] A? ns2.iotsecproject.tech. (51)
15:38:42.442771 IP ns1.domain > fw01.office.lon.exn.uk.34807: 37029*- 1/2/2 A 18.222.233.237 (115)
15:38:42.455957 IP resolver14.dns.sfr.net.31713 > ns1.domain: 25809 A? www.probe_20152.iotsecproject.tech. (52)
15:38:42.456096 IP ns1.domain > resolver14.dns.sfr.net.31713: 25809 NXDomain*- 0/1/0 (98)
15:38:42.456545 IP resolver16.dns.sfr.net.51101 > ns1.domain: 42859 A? www.probe_20152.iotsecproject.tech. (52)
15:38:42.456586 IP ns1.domain > resolver16.dns.sfr.net.51101: 42859 NXDomain*- 0/1/0 (98)
15:38:42.536717 IP fw01.office.lon.exn.uk.55658 > ns1.domain: 38789% [1au] A? www.probe_10027.iotsecproject.tech. (63)
15:38:42.536878 IP ns1.domain > fw01.office.lon.exn.uk.55658: 38789 NXDomain*- 0/1/1 (109)
15:38:42.537458 IP fw01.office.lon.exn.uk.51545 > ns1.domain: 12422% [1au] AAAA? ns1.iotsecproject.tech. (51)
15:38:42.537509 IP ns1.domain > fw01.office.lon.exn.uk.51545: 12422*- 0/1/1 (93)
15:38:42.538024 IP fw01.office.lon.exn.uk.64176 > ns1.domain: 3843% [1au] AAAA? ns2.iotsecproject.tech. (51)
15:38:42.538099 IP ns1.domain > fw01.office.lon.exn.uk.64176: 3843*- 0/1/1 (97)
15:38:42.717971 IP chic-cns10.nlb.mdw1.comcast.net.35549 > ns1.domain: 12425 [1au] A? www.probe_19931.iotsecproject.tech. (63)
15:38:42.718121 IP ns1.domain > chic-cns10.nlb.mdw1.comcast.net.35549: 12425 NXDomain*- 0/1/1 (109)
15:38:42.722094 IP cch2-cns01.nlb.ord1.comcast.net.43687 > ns1.domain: 8703 [1au] A? www.probe_19931.iotsecproject.tech. (63)
15:38:42.722156 IP ns1.domain > cch2-cns01.nlb.ord1.comcast.net.43687: 8703 NXDomain*- 0/1/1 (109)
15:38:42.722463 IP cch2-cns07.nlb.ord1.comcast.net.1079 > ns1.domain: 45151 [1au] A? www.probe_19931.iotsecproject.tech. (63)
15:38:42.722507 IP ns1.domain > cch2-cns07.nlb.ord1.comcast.net.1079: 45151 NXDomain*- 0/1/1 (109)
